symptom_id	docid	pre	text	post	bdi_query	bdi_name	majority	consensus	type	source
11	5hnoct_244_1	I know a lot of people, including myself, find exercising (especially on a treadmill) terribly boring.	I find myself constantly looking at the timer and not being able to focus fully on something else like a podcast, music, television, ect.	For those who have been in a similar situation and now really enjoy being present in their exercising, what did you do?	19	Concentration Difficulty	True	False	disagreement	erisk2025
11	5u3OPN_105_1	I am seriously dying for that kickoff.	I can't concentrate on work anymore.	Go United!	19	Concentration Difficulty	True	False	disagreement	erisk2025
11	60ghM5_67_1	I've tried to learn Italian (and a bit of German) by myself before, but I ended up giving up, haha.	I get too distracted!	Yeah, it'd be cool to have a Brazilian equivalent to reddit. :&	19	Concentration Difficulty	True	False	disagreement	erisk2025
11	6D2fAt_549_6	if i hear something and i dont associate it with something written i almost imediatly forget it.	my lack of focus effects my ability to remember (ADD) but if i make a CONCIOUS effort to remember something, it's stuck in my head for life.		19	Concentration Difficulty	True	False	disagreement	erisk2025
11	6REv7R_4972_18	It's too deep, and too dark for someone that age.	But I don't focus on it much at all.	But once I think of everything, I wonder why I've had such terrifying images in my head from such a young age.	19	Concentration Difficulty	True	False	disagreement	erisk2025
11	80ws6A_210_1	I personally like to listen to porn while i play.	Helps me concentrate.		19	Concentration Difficulty	True	False	disagreement	erisk2025
11	8NZ4Bg_15_11	To add insult to injury, by my reckoning, my mental and physical skills are much less than they used to be.	My focus and processing are way down, multitasking (my specialty) now takes effort, and my insight is clouded, too.	It's like someone put a dampener on my mental faculties.	19	Concentration Difficulty	True	False	disagreement	erisk2025
11	AU7oMb_902_0		Maybe I didn't focus enough.	Can you use spoiler tags and tell me why he DID push him off then? [	19	Concentration Difficulty	True	False	disagreement	erisk2025
11	AbiwVB_1146_0		My god I can't concentrate!	How dangerous!	19	Concentration Difficulty	True	False	disagreement	erisk2025
11	B9QSGI_500_3	"A lot of people I know don't really know what their ""thing"" is."	I'm sure it's quite hard to focus when you don't know what you're focusing on.		19	Concentration Difficulty	True	False	disagreement	erisk2025
11	C1Jqy9_2517_2	That book was the worst.	I tried multiple times to get through it, but it was just impossible to stay focused.		19	Concentration Difficulty	True	False	disagreement	erisk2025
11	CLng7z_1227_1	It has been this way since 1999 or 2000.	I used to be able to focus and concentrate and get things done.	I was under a lot of stress at my job and got very sick mentally and physically and then ended up with schizoaffective disorder.	19	Concentration Difficulty	True	False	disagreement	erisk2025
11	CzzqTs_368_1	Do you get headaches?	I love to sleep, but if I stay in bed for more than 9 hours I get a headache that wont go away, and cant concentrate on anything.		19	Concentration Difficulty	True	False	disagreement	erisk2025
11	DpHE60_1472_5	I think kind of slowly.	I get distracted very easily.	I could not hear myself fucking think and the teacher had asked them to quiet down a few times.	19	Concentration Difficulty	True	False	disagreement	erisk2025
11	E1IHtp_571_1	Hey, I like the feature!	I just couldn't keep my concentration		19	Concentration Difficulty	True	False	disagreement	erisk2025
11	G5xV2A_2015_2	I have ADD , OCD, and anxiety (a lovely combination!)	and I get overwhelmed easily.	And then I break down.	19	Concentration Difficulty	True	False	disagreement	erisk2025
11	HG0CI3_3492_0		I can concentrate and focus on stuff just fine, it's just sticking with stuff I have a hard time with!	LOL	19	Concentration Difficulty	True	False	disagreement	erisk2025
11	I29x1D_453_1	I recently realized i'm the only person i know that doesn't know how to kick their legs while swimming.	It's like my brain shuts off and i get confused.	I suppose it's because i was taught to swim in the sink or swim method but damn it's hard to remember those legs should be moving at age 23.	19	Concentration Difficulty	True	False	disagreement	erisk2025
11	ITta2P_1915_5	This is when I get the sweaty palms, lack of hunger, and headaches.	I do experience a noticeable difference in my ability to focus and how I'm reacting to stimulus.	2.	19	Concentration Difficulty	True	False	disagreement	erisk2025
11	KRoPdh_4714_3	The pink noise is just soooooo relaxing to me.	It also helps me concentrate when I need to focus on something.		19	Concentration Difficulty	True	False	disagreement	erisk2025
11	KWRrrc_493_1	So glad jets clinched yesterday.	I can actually focus in my task Saturday without being distracted.	To everyone one going to the game make sure the boys know how proud we all are of them.	19	Concentration Difficulty	True	False	disagreement	erisk2025
11	Li4Lg4_612_0		True, though I have so little concentration recently.	I'll do a Googling when I can focus more.	19	Concentration Difficulty	True	False	disagreement	erisk2025
11	LkBbKm_1311_8	I choose to have few friends, which I'm fine with most days.	I can't handle having to focus on many different people in my life.	Not because they all drop out of my life?	19	Concentration Difficulty	True	False	disagreement	erisk2025
11	Menuri_327_1	As someone who has it, it makes multi task like crap.	I can't focus on one thing and actually complete it.		19	Concentration Difficulty	True	False	disagreement	erisk2025
11	MhVky7_794_3	It's alright, I guess.	I'm in the back, so I get distracted pretty easily.	Plus, what they focus on isn't really suited to my interests.	19	Concentration Difficulty	True	False	disagreement	erisk2025
11	Mzl1W7_492_3	You can't make your fibro fit your lifestyle.	I had problems concentrating at work.	I struggled on for as long as I could, but eventually I had to quit.	19	Concentration Difficulty	True	False	disagreement	erisk2025
11	NL8nxM_1154_1	I couldn't imagine working in an open office.	I couldn't concentrate with other people chatting typing and on their phones.	Not to mention I might have 30 iPads sitting on a side table to update/config, no way could I leave them in an open area.	19	Concentration Difficulty	True	False	disagreement	erisk2025
11	Nfuldi_3777_2	And in a way, since I've become a brony, I'm not sure if new flaws have cropped up so much as I now notice them.	For one thing, I have the worst time getting motivated to work and focusing.	(In fact, I went to a counselor, they actually think I should go on meds.)	19	Concentration Difficulty	True	False	disagreement	erisk2025
11	Nfuldi_4185_2	For a while, I wanted to be a performing musician.	I could never really focus, though.	I've moved over to digital art now, but just becoming great at anything artistic would be lovely.	19	Concentration Difficulty	True	False	disagreement	erisk2025
11	NhDlSE_1869_4	I need to be able to step up in my life and start managing things more efficiently and completely.	I always get distracted or side tracked.	I have been plagued my whole life with almost being stuck inside my own head.	19	Concentration Difficulty	True	False	disagreement	erisk2025
11	OaZzwU_1173_3	I was in a folding chair cocked back against the wall of the snack shack.	I wasn't even concentrating.	Why would anyone ever rob a snack shack.	19	Concentration Difficulty	True	False	disagreement	erisk2025
11	OaZzwU_456_0		No, my ability to focus on anything is down to about 5 minutes.		19	Concentration Difficulty	True	False	disagreement	erisk2025
11	OvEflR_562_2	Bear in mind this is one of those cheap ones so I'm constantly worrying about ink leaking, but there is just something soothing about that scratchy sound when you write with it on paper.	It helps me focus.		19	Concentration Difficulty	True	False	disagreement	erisk2025
11	PFtKhj_2401_4	This is purely so I have to read the quest text and figure out what I'm doing.	It helps me stay focused.	Plus, it's more fun.	19	Concentration Difficulty	True	False	disagreement	erisk2025
11	QtydDp_7088_0		I find myself unable to focus on anything besides Bison's teeth.		19	Concentration Difficulty	True	False	disagreement	erisk2025
11	RSqKqY_28_10	If you're in the US- use the time you are in your home well, maybe study for the GRE.	(I know easier said than done cause if you're anything like me you have a really hard time concentrating too.)	Good Luck!	19	Concentration Difficulty	True	False	disagreement	erisk2025
11	SYwkDT_785_1	I can tell you from personal experience that Modafinil is amazing.	My ability to concentrate on it is off the charts.	Also I feel like my working memory is much better.	19	Concentration Difficulty	True	False	disagreement	erisk2025
11	T8hvzG_414_1	Repetitive tapping of any kind.	For some reason, I can't not focus on it.		19	Concentration Difficulty	True	False	disagreement	erisk2025
11	TPSCwH_2558_17	Meditation doesn't work for me either.	I'm too easily distracted.	"But this app has visuals and you can set it to ""buzz"" when you need to take a breath and I can play music over the top of it."	19	Concentration Difficulty	True	False	disagreement	erisk2025
11	TRL055_365_7	Sounds all around me became very washy.	I couldn't focus on anything expect what was going on in my own head.	I thought I was going to die every time I had one.	19	Concentration Difficulty	True	False	disagreement	erisk2025
11	TUPJLA_1651_6	It always bothered me to go back and try to re-read what I had underlined.	I'd get distracted.	If I copied the passages I thought were important, I remembered them better and could reference them in class.	19	Concentration Difficulty	True	False	disagreement	erisk2025
11	Tx9Y2S_584_1	It is possible for me to get rid of the pain as long as I continuously imagine the pain (imagined as a white disk protruding from my uterus) getting shaved down.	I cannot focus on anything else.		19	Concentration Difficulty	True	False	disagreement	erisk2025
11	U05S3m_291_4	I'm tired.	I can't focus.	My body feels like rubber.	19	Concentration Difficulty	True	False	disagreement	erisk2025
11	U4ZTlW_1041_2	Although I feel like I have to many hobbies.	I just can't seem to focus on one and perfect it.	It can be really mind numbing sometimes.	19	Concentration Difficulty	True	False	disagreement	erisk2025
11	UdJGLz_1491_4	It's SO loud!	It doesn't infuriate me, but I can't concentrate on anything else when that comes up on the tv.	I have to mute it or pause it or something.	19	Concentration Difficulty	True	False	disagreement	erisk2025
11	UdJGLz_386_4	Right now, my desk has a pair of speakers and a hard drive on it*; all my papers are organized in a filing folder on my (mostly empty) bookshelf.	I cannot concentrate if there is clutter around me.	Whether I'm typing an email or writing an essay, I need limited audiovisual distraction or my work suffers.	19	Concentration Difficulty	True	False	disagreement	erisk2025
11	VG2vZH_638_3	For everything else I have games, movies and series.	I couldn't concentrate on a novel these days.		19	Concentration Difficulty	True	False	disagreement	erisk2025
11	XKK6Uz_671_10	I hated the feeling that I had no control of my body and that I was too weighed down to move.	I also hated that I lost all focus and couldn't even play a game because I kept forgetting what I needed to do.		19	Concentration Difficulty	True	False	disagreement	erisk2025
11	Y9UGYr_87_8	You will find your mind straying, and when it does, bring it back to your focus on your breathing.	I find in meditation, to focus on one thought helps.	If I want to work on a specific chakra I focus on that colour.	19	Concentration Difficulty	True	False	disagreement	erisk2025
11	Zscew9_21_2	I have been struggling with this for what seems like almost a decade.	I cannot concentrate in lectures, my mind goes blank and I'm just staring, I'm not focused, I think way too much.	I am worried of failing and have dropped the subjects.	19	Concentration Difficulty	True	False	disagreement	erisk2025
11	af8XR5_1614_1	For me it's not necessary bad bugs etc, but after staring at code 9 all day long (which is awesome) I'm too tired to do the same after work.	I would love to, but nothing good comes out of it, I just can't concentrate good enough.	Weekends are better, but usually already have other stuff to do then	19	Concentration Difficulty	True	False	disagreement	erisk2025
11	bR763Z_47_2	If you miss a question, it will **not** be repeated.	I'll be constantly telling myself to focus, and will be doing fine, when all of a sudden, I realize that I've just missed half the math question and now can't solve the problem.	I don't even realize it, it just happens.	19	Concentration Difficulty	True	False	disagreement	erisk2025
11	baIp0M_11_160	It’s just so much to handle.	I can’t think straight.	I’m not mad though.	19	Concentration Difficulty	True	False	disagreement	erisk2025
11	d0s5Ul_962_1	I don't feel happier at all, although that is likely to be due to the several fold increase in effort I have to put through my day.	I don't think it helps with focus either.	However, lately I've been feeling a stronger willpower that allows me to try harder at focusing and thus improve it.	19	Concentration Difficulty	True	False	disagreement	erisk2025
11	dZqz8Y_456_3	Don't get me wrong, I like my current PC, but it's a little bit too big and especially loud.	It's really hard to focus, when I'm doing papers for my faculty, etc.	This university year I can not afford to be sloppy, because I'm writing my thesis.	19	Concentration Difficulty	True	False	disagreement	erisk2025
11	dZqz8Y_457_3	Don't get me wrong, I like my current PC, but it's a little bit too big and especially loud.	It's really hard to focus, when I'm doing papers for my faculty, etc.	This university year I can not afford to be sloppy, because I'm writing my thesis.	19	Concentration Difficulty	True	False	disagreement	erisk2025
11	dlDLbw_2247_5	I need to get on that.	It's so hard for me to relax, or keep my attention focused when there's so much to be done!		19	Concentration Difficulty	True	False	disagreement	erisk2025
11	eP2CT2_1569_1	I'm the exact opposite I get adrenaline/anxiety during random or stressful situations and I absolutely hate it.	I can't focus on the task at hand.		19	Concentration Difficulty	True	False	disagreement	erisk2025
11	eP2CT2_5522_4	Also, I was getting the benefits people were always gloating about online.	I was able to focus and concentrate on whatever I was doing.	I think the only con I have on this medication is the loss of appetite but I'm actually okay with that because I eat little snacks throughout the day and I think that's actually healthy as opposed to eating three gigantic meals (which I used to do).	19	Concentration Difficulty	True	False	disagreement	erisk2025
11	eZ0mW0_603_14	"I am interested in becoming ""the perfect game developer"" Instead of specializing in 1 thing, I want to be ""20% good"" at 5 things."	I also can't seem to focus on one thing for to long.	I have done woodworking, metal shop, SCUBA diving, golf, loads of computer related things, ive done studies into health and how to lose weight.	19	Concentration Difficulty	True	False	disagreement	erisk2025
11	fSrPWk_2089_0		&gt; My mind is focused on so many different things and I really have a lot of work stuff to focus on.	Like I talked about in my first post I run a small business (a restaurant) and we have a lot of improvements we have to do before the busy season hits.	19	Concentration Difficulty	True	False	disagreement	erisk2025
11	g4Mvcs_1318_2	It's like the world is moving around me at a fast pace and I am in this bubble.	I can't concentrate other than the physical sensations I have (I get a ton of physical sensations that drive me crazy).		19	Concentration Difficulty	True	False	disagreement	erisk2025
11	gzpEMZ_185_1	When I code at work and the room gets too quiet I quietly quack like a duck.	It helps me concentrate.		19	Concentration Difficulty	True	False	disagreement	erisk2025
11	itOev0_1279_0		I find it helps me concentrate on certain things (also a programmer, I have really bad add and it really, really helps.)		19	Concentration Difficulty	True	False	disagreement	erisk2025
11	ix58rf_62_1	This is a good description of how I feel while I'm having a petite mal seizure.	I can hear and see, but can't focus.	I can't talk and can't move.	19	Concentration Difficulty	True	False	disagreement	erisk2025
11	jCb4fg_4110_2	I started that while I was still about 76kg and lost about a stone since being on it.	I've tried eating less (1350 according to mfp) and I ended up feeling light headed and I couldn't concentrate.	If something is shop bought ive entered the calories on the packet.	19	Concentration Difficulty	True	False	disagreement	erisk2025
11	kITjOR_2599_0		I can never focus when listening to the damn things.	My mind always gets caught on one image, or scenario or concept, and spends a few minutes playing through that, and seeing alternate ways it could go.	19	Concentration Difficulty	True	False	disagreement	erisk2025
11	kbJx7O_1207_5	so most of my decisions revolve around this.	it helps me stay focused.	and when I achieve something that puts me closer to my goals, I get happy!!!	19	Concentration Difficulty	True	False	disagreement	erisk2025
11	lE2J52_2496_4	But for some reason, I couldn't finish it.	I couldn't focus.	I didn't think the news had affected me, but for the life of me I could not think straight.	19	Concentration Difficulty	True	False	disagreement	erisk2025
11	nC2asQ_1157_8	&gt; I don't know how to get out of this, how to calm my mind enough.	I can't even focus enough to meditate these days!	I know it's a big rant, but I need some direction.	19	Concentration Difficulty	True	False	disagreement	erisk2025
11	nEOCfH_2336_85	"I'm finishing these 50m (300m total) with PERFECT form (Perfect to me probably sloppy if you were watching :] ) I swim over to the ladder and the lifeguard says ""Don't you hate when that happens"" And I respond with a quick yes and continued back to my lane because shes really cute and Id love to sit and talk to her but its not about that."	I need to stay focused.	I tighten up and dive in.	19	Concentration Difficulty	True	False	disagreement	erisk2025
11	o1yUZp_196_2	August 5th 2283	I can't... I can't concentrate.	Too much fire to concentrate.	19	Concentration Difficulty	True	False	disagreement	erisk2025
11	pjYInz_508_5	I just... Stare a lot.	Sometimes I'm even zoning out and not thinking about anything.		19	Concentration Difficulty	True	False	disagreement	erisk2025
11	pzIG0j_43_3	When I'm watching a film or series that is subtitled in one of these languages but spoken in the other, I cannot stop myself reading them.	It's incredibly frustrating because I can't concentrate on the scenes themselves.	It also tends to be the case that subtitles don't always perfectly match the dialogue, so in addition to the above I am consistently doing a mental translation of the text as we go.	19	Concentration Difficulty	True	False	disagreement	erisk2025
11	qTbOnm_5802_12	To this day they visit her/her family in secret while I'm at work.	* Leave uni within weeks after that happened because I couldn't concentrate on my severely demanding course with everything that was going on.	* Started taking quetiapine.	19	Concentration Difficulty	True	False	disagreement	erisk2025
11	rhMXIV_1986_1	None.	I can't concentrate if I'm being distracted by music.		19	Concentration Difficulty	True	False	disagreement	erisk2025
11	ryXhMY_71_3	It's a problem.	If I can focus longer than a few minutes on something than I focus to the point of obsession..like sometimes I have a problem stopping something once I start it.	My little cousin is exactly like me and was told it's a lesser known attribute of ADD...I'd be curious to know what you think.	19	Concentration Difficulty	True	False	disagreement	erisk2025
11	sUyud0_1315_1	Something about this pic is tripping me out and I have no clue what it is!	It's like my eyes can't focus on one thing.		19	Concentration Difficulty	True	False	disagreement	erisk2025
11	thpFSq_932_3	Like adding resistance to your weightlifting.	It was hard to concentrate, but that meant when I finally got to concentration it was much stronger.	I totally agree with the first half of your comment, and that was the reason I stopped doing it.	19	Concentration Difficulty	True	False	disagreement	erisk2025
11	uAtH3w_501_9	I had my dad check my BP and it was a lot higher than it usually is, but not in the stroke level.	I was lightheaded and couldn't focus.	Then I started dry heaving.	19	Concentration Difficulty	True	False	disagreement	erisk2025
11	uAtH3w_502_9	I had my dad check my BP and it was a lot higher than it usually is, but not in the stroke level.	I was lightheaded and couldn't focus.	Then I started dry heaving.	19	Concentration Difficulty	True	False	disagreement	erisk2025
11	uOK8ds_1861_6	I don't want to stifle him, however, its just hard to digest.	With all of that, i'm just not able to concentrate on anything else.		19	Concentration Difficulty	True	False	disagreement	erisk2025
11	vMlwfq_1139_2	You can go take a walk, talk to your buddies on skype, or play some normals.	This helps me calm down and get focused again.		19	Concentration Difficulty	True	False	disagreement	erisk2025
11	vZ0PcL_4_3	I won't say I was a shy introvert earlier but even then my confidence in social situation is apparently increAsing	- I always had problem focusing on anything,even studies and now I can concentrate easily.	- More sexually confident,cockier,dominant.	19	Concentration Difficulty	True	False	disagreement	erisk2025
11	ynZRlH_597_0		I cant concentrate if it's not on a physical board.	I don't know why.	19	Concentration Difficulty	True	False	disagreement	erisk2025
11	0SdkxL_80_17	I can barely work.	I can't concentrate.	I want to cry of fear.	19	Concentration Difficulty	True	True	agreement	erisk2025
11	0fOwS5_235_2	Well, without it my thoughts are disorganized, such that it's hard to concentrate on complex things.	I know I'm capable, but the amount of effort I have to put forth in order to concentrate is so much that I often just get frustrated and give up.	I'm tired all the time, no matter how much I sleep.	19	Concentration Difficulty	True	True	agreement	erisk2025
11	0fOwS5_912_7	It usually subsides when I am focused on something, such as work or video games, etc, and listening to other music will always push it out, but when it's bad and my brain is unoccupied and no other music is playing, the same 5-10 second part of the song in my head will always come back.	It can get in the way of concentrating on other things sometimes even pushing the thoughts I want to have aside.	Adderall made this go away.	19	Concentration Difficulty	True	True	agreement	erisk2025
11	0vhtdX_1981_1	"""ADD = good at multitasking"" is a myth."	My attention is no more fluid than anyone else's, it's just any distraction is far more destructive to my concentration.	A single stray thought can completely wipe out my short term memory, requiring tens of seconds to remember what I was just doing.	19	Concentration Difficulty	True	True	agreement	erisk2025
11	11GnNs_3578_0		I have a short attention span.	And I like playing with new things.	19	Concentration Difficulty	True	True	agreement	erisk2025
11	15bAXU_184_6	I can't escape the sadness, I know it's just a mental effect from quitting but I just can't seem to cheer the fuck up.	I can hardly concentrate on any of my assignments for University either and the deadlines are cropping up...I just have bad feelings and bad thoughts floating around in my head constantly that I just can't focus on anything else.	Redditers, what do? :(	19	Concentration Difficulty	True	True	agreement	erisk2025
11	15bAXU_223_13	And now I'm sat here, waiting for friends to watch stuff while I run back home to retrieve the save file off my mac and return.	I can't concentrate at home, hence why I'm doing my work here.	But still, the temptation to smoke has been the highest today than it has been in the past few weeks.	19	Concentration Difficulty	True	True	agreement	erisk2025
11	15bAXU_76_3	I'm doing a film production course and a Japanese top up degree.	I have so much work, my brain has exploded and I just can't concentrate anymore :(		19	Concentration Difficulty	True	True	agreement	erisk2025
11	16Jn2Z_2069_3	but ...	I struggle with my attention span and sometimes ...	SQUIRREL!!!!!	19	Concentration Difficulty	True	True	agreement	erisk2025
11	16Jn2Z_4694_0		I get super distracted VERY easily.	I was supposed to get the final version of this website project done last week but I have been jamming to YouTube playlists and watching #FailArmy.	19	Concentration Difficulty	True	True	agreement	erisk2025
11	2HM9wf_387_21	Sorry, off topic again.	I can't keep myself focused.	So... two nights ago.	19	Concentration Difficulty	True	True	agreement	erisk2025
11	2LC7sr_1022_3	It's about how you DISPERSE attention.	I can't really control the amount of attention I pay - I can hyperfocus on doing XYZ for hours, or get wrapped up on cleaning one tiny corner of my room for hours, while I can't focus on doing the rest at all.	This has been my experience both off and on meds.	19	Concentration Difficulty	True	True	agreement	erisk2025
11	2e9glq_3059_1	I'm hoping something will work for me.	I definitely need to work on concentrating my thoughts; it's such an issue for me.	I would love to try massage therapy or acupressure/acupuncture, but I don't have the money to do it.	19	Concentration Difficulty	True	True	agreement	erisk2025
