symptom_id	docid	pre	text	post	bdi_query	bdi_name	majority	consensus	type	source
5	gHLn9l_71_1	I cant seem to face up to the facts.	I'm tense and nervous and I cant relax.	I cant sleep because my beds on fire, don't touch me I'm a real live wire....a psycho killer.	11	Agitation	True	True	agreement	erisk2025
5	ikwH4R_242_4	and then snoozed it every ten minutes until 9:30.	I'm very sleep deprived and very agitated!	Glad there's someone I can relate to!	11	Agitation	True	True	agreement	erisk2025
5	jeCAL4_255_2	I know it's cliché, but it really does help to center me.	I am much more relaxed and have infinitely more patience throughout the day as a result.	I would recommend using guided meditations to start.	11	Agitation	True	True	agreement	erisk2025
5	jeCAL4_711_0		My heart just started racing...  This makes me way too anxious...		11	Agitation	True	True	agreement	erisk2025
5	kZFk8K_469_2	I mainly started Evekeo because I was feeling antsy and jittery and was having problems focusing and my Vyvanse wasn't cutting it anymore.	But although I'm feeling more emotionally balanced and a little more focused I've found that I'm still rather antsy.	I feel like I can't relax, that I always have to be doing something.	11	Agitation	True	True	agreement	erisk2025
5	kZFk8K_469_3	But although I'm feeling more emotionally balanced and a little more focused I've found that I'm still rather antsy.	I feel like I can't relax, that I always have to be doing something.	It's a horrible feeling and I was wondering what anyone else does when feeling this way???	11	Agitation	True	True	agreement	erisk2025
5	kxid9A_268_3	I am experiencing some positive results.	My anxiety is better, I feel more relaxed and happy.	Since I am quite thinking type (MBTI type ISTJ) I still can not free myself of messing with past and analyzing almost anything.	11	Agitation	True	True	agreement	erisk2025
5	nszZrs_5325_5	If I'm really not moving or doing anything (expending any energy) I could easily go all day without eating and feel very little symptoms.	When I'm working, which is physically intensive, I will begin to have a little bit of jitters, feel weak, get anxious, impatient, and sometimes irritable.	That's about it.	11	Agitation	True	True	agreement	erisk2025
5	pWCgOz_4850_0		I feel the same thing coming on and it's making me every anxious.	I feel like screaming at the top of my lungs and then jump kicking someone in the face	11	Agitation	True	True	agreement	erisk2025
5	pdL16N_1522_2	Several times before, out of my house.	I'm not anxious (as far as I know, maybe subconsciously?)	but this *is* the first time this has happened, so that could explain it.	11	Agitation	True	True	agreement	erisk2025
5	pfAz7X_520_16	Normally, I have really bad anxiety.	I'm always extremely stressed, tense, and thinking every second.	"I don't even think I am necessarily ""worrying,"" though...my mind is just freaking out 24/7."	11	Agitation	True	True	agreement	erisk2025
5	pfAz7X_521_1	I am definitely an introvert, so I love, need to be alone...but I do get lonely.	I am never relaxed, though; always restless.	I think I start to think that maybe I'll feel better if I'm around people?	11	Agitation	True	True	agreement	erisk2025
5	pg133X_318_2	I ended up loving it as a hobby.	I'm a pretty anxious person and fidget with my hands quite a lot.	I don't use any nicotine in my juice but it keeps my hands busy and steady.	11	Agitation	True	True	agreement	erisk2025
5	plNNBH_4276_4	Honestly, I like the fact that she can answer any question I have.	I have been so calm during certain stressful moments.	I can't speak for the labor part yet, but I can't imagine not having a doula.	11	Agitation	True	True	agreement	erisk2025
5	qLupEG_1487_1	I wish I could game.	I get nervous like I should be doing something else.		11	Agitation	True	True	agreement	erisk2025
5	qTbOnm_4370_1	I found meditation helped me slow down so I could focus more than concentrate... if that makes sense.	I tend to rush a lot and constantly be in an anxious state about the silliest things like cooking, but meditating (when I do it regularly) teaches me to calm down a lot.	"It has my mind going in slow motion (which would be ""normal motion"" for other people) which does help me focus on particular tasks better."	11	Agitation	True	True	agreement	erisk2025
5	qTbOnm_5372_2	I'm suddenly feeling really panicky, really uncomfortable in my body and really uncomfortable in my environment (home, my bedroom - my haven!).	It's almost restlessness or agitation, like I need to escape and go out for a run or literally run away or something.	I don't think I've ever felt this before.	11	Agitation	True	True	agreement	erisk2025
5	qTbOnm_5968_29	Pretending to be so self-assured has become habit now, and I'm terrified I might be breaking out of that habit.	I'm feeling overly anxious and I don't know how to stop it.		11	Agitation	True	True	agreement	erisk2025
5	qYXkMm_143_3	And again and again.	Idk ugh i just get really agitated doing nothingg but i dont have the energy to do anything actually meaningful		11	Agitation	True	True	agreement	erisk2025
5	qtLx9w_1104_0		I'm always anxious too.	"I've learned that you kinda give future you a little shove from the present moment with a thumbs up and smirk like ""don't forget you will come back""."	11	Agitation	True	True	agreement	erisk2025
5	r1xcyj_762_24	I'm sure the dreams that make me feel like I'm not even asleep, going to the bathroom so often, and now this incessant itching aren't helping.	I have the usual side effects of restlessness.	My ears started ringing once last week (which I noticed because it was weird for me.. but only happened once).	11	Agitation	True	True	agreement	erisk2025
5	remFA0_79_12	I do feel more in control now though.	I also feel a lot more relaxed and less tense everyday.	* I've been noticing random performance swings in my speaking abilities.	11	Agitation	True	True	agreement	erisk2025
5	rvnUUG_482_1	see, most of the times its my highs that get in the way of me doing work.	I get too hyper and i wanna move around.	I dont wanna be sitting down in a desk all day.	11	Agitation	True	True	agreement	erisk2025
5	thpFSq_456_2	Before I begin I should come out and say that I have an agenda in mindfulness and meditation.	I'm sick of feeling anxious.	"It's a feeling that severely limits me as a person and my ability to be creative and enjoy life in general... I say this because I know that meditation in general is simply about ""being"", and I try to connect with that state during each session, but maybe with such a strong agenda, I'm straying from where I should be..."	11	Agitation	True	True	agreement	erisk2025
5	tqH9Oy_501_1	I tried so many times myself to sit down and read, and i i've tried so many different books.	But i never manage to finish them, because i get restless and need to move or do something else at the same time.	Then again, nothing against reading - and i envy those who are able to complete book by book and still love it as much everytime they read something.	11	Agitation	True	True	agreement	erisk2025
5	u4O8lz_3712_0		As of lately I've had a lot of stress and anxiety.	Most of it stems from school but it just builds and builds until it feels like it's too much.	11	Agitation	True	True	agreement	erisk2025
5	u9MicZ_2248_1	I fucked up with someone I care about, and trying to fix things is eating away at me.	I have extreme stress and anxiety which makes it difficult for me to deal with stressful situations.	I started talking to a guy that I've known for about 4 years but never really got to know well, we were more acquaintances than friends really.	11	Agitation	True	True	agreement	erisk2025
5	uxtGCV_1586_1	Anxiety, not even necessarily social anxiety.	I'm just anxious as fuck.	I'm even anxious about going to talk to someone to get on medication because I'm anxious that they will think I'm just trying to score drugs.	11	Agitation	True	True	agreement	erisk2025
5	v9qMLF_1055_1	Unemployment is dragging on and I feel like I can't get my indie line started soon enough.	I'm feeling stressed and antsy.	I have a migraine that won't go away no matter how I treat it.	11	Agitation	True	True	agreement	erisk2025
5	vEVzQ6_443_1	I just switched from risperidone.	I'm shaking and anxious.	My leg is shaking uncontrollably.	11	Agitation	True	True	agreement	erisk2025
5	vFdomr_20_8	That helped me a bit.	I'm a very anxious person too.		11	Agitation	True	True	agreement	erisk2025
5	xHDwW6_3269_0		I tend to feel frozen and paralyzed when anxious.	If it's accompanied by dread or fear, I get a cold sensation around my shoulders that sinks down my back.	11	Agitation	True	True	agreement	erisk2025
5	yLC6n6_84_0		I have had bad anxiety to the point of regular panic attacks much of my life.	I was expecting increased anxiety, but Adderall actually makes me feel calmer.	11	Agitation	True	True	agreement	erisk2025
5	z1TPXt_1275_3	He should probably seek medical help for his inability to sleep soundly.	I know that when I have a restless night, I am miserable as all hell in the morning and can barely roll out of bed.	I see that you said he has anxiety - I do, too.	11	Agitation	True	True	agreement	erisk2025
5	zidVve_127_1	Oh no it's just that I don't WANT to avoid doing a lot of work.	I get really restless when I'm not being productive, so an entire year of just sitting around would drive me insane.		11	Agitation	True	True	agreement	erisk2025
6	0MG3bC_7060_1	I think i watched this loop for 3 minutes.	I feel so relaxed.	And kinda amazed	11	Agitation	True	False	disagreement	erisk2025
6	0xzEQe_111_20	If I'm not, fuck that, because that gives me anxiety.	I smoke to curb the anxiety.	What makes it worse is that the anxiety doesn't even get to be dealt with.	11	Agitation	True	False	disagreement	erisk2025
6	0xzEQe_573_2	Hopefully with some therapy and or medication things dont seem to be as hard to do, as is what I am experiencing myself.	Sometimes I feel great in a car, some times, I feel really restless and I cant sit still, it depends whos driving though.	If it is my mom, I feel pressure and I can hardly stay in my seat.	11	Agitation	True	False	disagreement	erisk2025
6	16Jn2Z_3600_1	An hour afterwards, I guess must've been coming down from a little happy mania?	I had a mild anxiety attack.	:(	11	Agitation	True	False	disagreement	erisk2025
6	1sBq6y_1280_6	I would say you are thinking about more than just yourself which is a good thing, yet hard.	As for my day,, I felt a lil restless and not down, more unsure what to do downess.	I left the house for the first time in a  week plus, I went to the corner store.	11	Agitation	True	False	disagreement	erisk2025
6	1sBq6y_1566_0		I think it is even though anxiety seems like avoiding something or doing something you body and mind are hyped up, mind is working at 150%, body is tensing and feeling tightly bound and wants to run away, but the staying in that extended fight or flight mode just drains your battery, it is in fact an intense activity.		11	Agitation	True	False	disagreement	erisk2025
6	2e9glq_2623_0		I've always had really bad anxiety.	I've gotten decent about driving to places I know.	11	Agitation	True	False	disagreement	erisk2025
6	2e9glq_2625_2	People think I'm crazy for it.	I've had anxiety issues for a really long time.	I've been on and off meds.	11	Agitation	True	False	disagreement	erisk2025
6	2e9glq_3484_1	I'm just bad with Skype and phones and such.	I have an anxiety disorder to be completely honest.	I hope we can figure something out. :(	11	Agitation	True	False	disagreement	erisk2025
6	2e9glq_773_1	That's wonderful.	I actually have really horrible anxiety.	=/ You're doing such a wonderful thing, it makes me so happy. :)	11	Agitation	True	False	disagreement	erisk2025
6	2uQrTW_59_2	I got super anxious after like 24 hours and had to leave the house.	I need to get out, otherwise I get anxious.		11	Agitation	True	False	disagreement	erisk2025
6	38qXcR_3426_7	She fell out my hands and onto the floor.	I was panicking so much.	She was flipping around so much.	11	Agitation	True	False	disagreement	erisk2025
6	3CAET8_103_0		I have had severe anxiety since I was young.	When I was about eight years old, I had an existential crisis in the middle of Jimmy Neutron because I realized that, at some point in time, everyone I know will be dead.	11	Agitation	True	False	disagreement	erisk2025
6	3CAET8_940_2	It unnerves me to no end.	I always have to have background noise or I get extremely anxious.	Because of this, I sleep with the TV on, and have a hard time falling asleep at other people's houses because I don't want to leave their TVs on and run up their electrical bill.	11	Agitation	True	False	disagreement	erisk2025
6	3PEEsM_1411_18	"Also, there is no such thing as ""just"" deluding."	I have horrible anxiety problems, which have driven me to near-suicide in the past.	These attacks were triggered by things as small as being unable to figure out a single problem on a homework assignment, which clearly aren't worth suicide.	11	Agitation	True	False	disagreement	erisk2025
6	3dbXZX_1662_8	And rushed to get ready got their at 11:30.	My anxiety was bringing up a small panic attack.	But I rallied and when I met my friends my anxiety was fine!	11	Agitation	True	False	disagreement	erisk2025
6	3hgU9N_4285_40	I constantly worry about things that they should be worrying about.	My anxiety is sky high.	I have nightmares every night and panic attacks.	11	Agitation	True	False	disagreement	erisk2025
6	3hgU9N_4569_3	After a couple bad experiences, I decided to avoid most social outings and cut some people out of my life.	I now find my anxiety at an all time high.	I do think it is connected, and now I have to suffer through that anxiety while getting myself back into the swing of things.	11	Agitation	True	False	disagreement	erisk2025
6	3hgU9N_4688_0		I've had periods of this, mostly driven by anxiety and underlying frustrations.	One thing that has helped me is this.	11	Agitation	True	False	disagreement	erisk2025
6	4kqpuA_596_0		My anxiety is completely crippling.	I haven't been able to work for years.	11	Agitation	True	False	disagreement	erisk2025
6	4oFWo4_1728_1	I feel so good!	I feel stronger, happier, calmer, and more energized.	Yay!!!! :) *	11	Agitation	True	False	disagreement	erisk2025
6	59NOL1_322_0		I've been having a stressed out anxiety ridden week.	I've had issues with my eating but not bad enough to be considered anorexic.	11	Agitation	True	False	disagreement	erisk2025
6	5a8S64_857_5	What's something I can do to keep myself occupied instead of knitting?	"I use knitting as ""productive fidgeting"", as I get restless and have to be doing something most of the time."		11	Agitation	True	False	disagreement	erisk2025
6	5fqpEl_2157_0		I have severe anxiety and panic attack disorder.	I have been hospitalized three times because of my horrendous panic attacks.	11	Agitation	True	False	disagreement	erisk2025
6	5fqpEl_410_3	I thought it was pregnancy related, but they have continued since giving birth.	The other night I was very anxious before bed.	I woke up with night terrors three times in a row within an hour and a half.	11	Agitation	True	False	disagreement	erisk2025
6	5fqpEl_634_0		Because I was a nervous wreck.	He did have a point.	11	Agitation	True	False	disagreement	erisk2025
6	5j64PU_6481_5	I honestly can't stand my post-yoga meditation.	I get all fussy and have a hard time sitting still.	It's not that I *can't* sit still, it's that I feel like I'm wasting my time.	11	Agitation	True	False	disagreement	erisk2025
6	6LTzFz_331_0		Right now my anxiety is a mess.	Whenever I sit down to do homework I panic.	11	Agitation	True	False	disagreement	erisk2025
6	6ohnbb_697_9	But the constant noise, be it loud music, crying children or shouting has got to stop.	It's interfering with my already low levels of sleep, my nerves and my sanity.	And if it doesn't stop, I will report you.	11	Agitation	True	False	disagreement	erisk2025
6	7G3eCN_1190_5	I got stuck.	I was panicking, and couldn't free myself.	"I began getting tunnel vision, and was freaking out thinking, ""This is how I die."""	11	Agitation	True	False	disagreement	erisk2025
6	7G3eCN_2596_1	Damn, aside from the fact that you like girls, I would've thought I wrote this.	My nervous energy turns to constant chatter.	I can clearly see the person losing interest in what I'm saying, try to recover by switching to them, but by then I'm already kicking myself in the ass for opening my mouth.	11	Agitation	True	False	disagreement	erisk2025
6	7Q1mDo_1017_10	I know there is some background needed on my break up, but I'm just trying not to worry about that as much as why I hate being single.	Why I'm so anxious all the damn time.	Why just about anything can completely kill my mood and I have a hard time finding things to be excited about that aren't female related.	11	Agitation	True	False	disagreement	erisk2025
6	7V0fvr_145_0		I've been having bad anxiety every morning, and it lingers on throughout the day.	I've been meaning to get into meditation to help me.	11	Agitation	True	False	disagreement	erisk2025
6	7fKjeS_1659_14	I don't wake up feeling groggy and my husband said I don't really snore, or if I do it isn't loud enough to bother him.	I also have pretty severe anxiety, and my brain was really active last night before I fell asleep (which was the last time it happened).	It doesn't really seem like sleep apnea as everyone else seems to experience it (from what I've read online) but I don't know if anxiety can manifest like this either, or if it is something else entirely.	11	Agitation	True	False	disagreement	erisk2025
6	7vZdqk_2060_2	Or, if I'm between doing tasks and being told to do something that either was not in or lower on my task list.	I have the type of ADD where I get hyper-focused on what I'm doing and get agitated when I'm interrupted.		11	Agitation	True	False	disagreement	erisk2025
6	82RRox_1045_9	Keep in mind that each appointment is months apart.	I'm getting very agitated.	"I outright told endo ""If I don't get hormones soon, I'm going to self-medicate."""	11	Agitation	True	False	disagreement	erisk2025
6	82RRox_1984_4	1.)	It makes me more self-confident, I feel calm in my body for once, and ultimately I'm happier.	2.)	11	Agitation	True	False	disagreement	erisk2025
6	82RRox_3365_2	For a while, whenever I masturbated, there was no semen.	I was more calm and relaxed.	Lately, though, there has been semen, and I've been masturbating more overall.	11	Agitation	True	False	disagreement	erisk2025
6	82RRox_3881_2	The peak passed a while ago.	I just feel calm and mellow, but this feeling has lasted for three hours without going down much.		11	Agitation	True	False	disagreement	erisk2025
6	8C387e_132_1	A mix of fear and hopelessness.	I have anxiety disorder as well.	I have a very strong fear of failure, which leads to me not attempting things, which leads to me not moving forward, which leads to me feeling stuck, which leads to me feeling helpless, which makes my anxiety worse.	11	Agitation	True	False	disagreement	erisk2025
6	9U2ssE_5045_2	I'm really hoping I can land a second date because damn I don't meet someone who's close to my ideal every day, but she's busy with midterms, so I understand if she's stressed and slow to respond and all.	But it still makes me antsy.	My friends say I'm overthinking and I'm just crushing hard on her.	11	Agitation	True	False	disagreement	erisk2025
6	9cGGuk_67_8	After what felt like 30 seconds, I looked around me and realized I had drifted 75 m from the edge.	I began to panic.	But quickly calmed myself and swam back.	11	Agitation	True	False	disagreement	erisk2025
6	9n5fxL_345_1	It's happened to me so much I know what's happening every time now.	I still get a little panicky, but I now just focus on moving my fingers one at a time.	I had one early this morning, I was dreaming and I literally felt the transition from dream to awake.	11	Agitation	True	False	disagreement	erisk2025
6	9rwsD8_927_13	"He said ""I'll follow you anywhere"" and stuff like that."	I had this anxiety all the time.	Every time I had a pang of 'damn I could stay here forever' it broke my heart because I knew he wasn't happy here.	11	Agitation	True	False	disagreement	erisk2025
6	A7EyhW_209_1	I'll tell you this isn't a preferable experience.	I usually feel restless and can't move at the same time.	This is not a hallucigen, this is a delirium.	11	Agitation	True	False	disagreement	erisk2025
6	BFUdG1_2900_0		I have anxiety.	The litany sometimes helps me get through acutely anxious times.	11	Agitation	True	False	disagreement	erisk2025
6	BYxNAU_88_0		I have an anxiety issues as it is.	For many years now.	11	Agitation	True	False	disagreement	erisk2025
6	BlWFld_1409_0		I'm just nautious and jittery.	I've seen all the fucked up videos I could find and this is a totally new feeling.	11	Agitation	True	False	disagreement	erisk2025
6	Bqce5J_217_1	I'm actually one of the rare people that doesn't like being outside.	It makes me anxious and stressed out.	Inside is comfortable to me.	11	Agitation	True	False	disagreement	erisk2025
6	Bqce5J_511_4	and i know that i have no one to talk with, so the whole point is moot to start off.	i feel anxious and get that little endorphin rush.	but it just trails off and i get this weird numb to the world feeling.	11	Agitation	True	False	disagreement	erisk2025
6	Bw3KsD_629_0		I take an advil when I get restless legs and it works almost every time.	Getting my husband to massage my legs while I try to relax is also pretty effective if he will do it for long enough.	11	Agitation	True	False	disagreement	erisk2025
6	CY9Ld4_6770_0		I had a high stress job and was anxious all the time.	I finally quit and took a break to do something less stressful but I found I would just stress MORE about the few things I could stress about so my stress level still felt the same.	11	Agitation	True	False	disagreement	erisk2025
6	CkOwhm_182_0		My anxiety has flared up again really badly.	It's the first day back at sixth form and I only have one lesson today, so I'm not exactly busy.	11	Agitation	True	False	disagreement	erisk2025
6	DViWT0_459_0		My anxiety has been creeping higher and higher the past few days.	I'm 9 + 1 today and I THINK things are going well.	11	Agitation	True	False	disagreement	erisk2025
6	DViWT0_565_6	I know she wanted to beat my Nanna to it but I thought she would have waited until tomorrow!	I feel so much more relaxed now that is out of the way :)		11	Agitation	True	False	disagreement	erisk2025
6	ESkQE5_362_1	I know this advice is unsolicited but you could always switch to a non-stimulant like strattera.	I feel relatively stimulated 24/7 and it has improved my mood tons.	Good luck finding something that works for you	11	Agitation	True	False	disagreement	erisk2025
6	FASP7Q_314_0		I'm now feeling jumpy and restless.	It's like crappy meth must feel like.	11	Agitation	True	False	disagreement	erisk2025
6	FCLsVJ_92_2	She just sent a few weird text messages so it adds some very nasty feelings and I'm all torn inside.	I try to stay as calm as possible.	Going to work out right now.	11	Agitation	True	False	disagreement	erisk2025
6	FQqg4j_3700_4	My usual Kratom regiment kills my anxiety and makes me feel great.	Today I was more uncomfortable and anxious than I usually am.	I also took more than I usually do because the Kratom seemed to not be kicking in as fast as it usually does, which is where I made my mistake.	11	Agitation	True	False	disagreement	erisk2025
6	Fg2Dvt_107_2	Keto is a game changer.	I used to feel anxious all the time, and now I don't.	I have become more focused over the past few weeks.	11	Agitation	True	False	disagreement	erisk2025
6	Fuy0x2_649_1	I have some sleep problems and often wake up feeling like I've been kicked down a flight of stairs while I was sleeping.	I tend to move around a lot while I sleep, wake up often, have to keep repositioning myself since it hurts to be in one position for very long.	I wake up with unexplained bruises, kinks in strange places, and various aches and pains.	11	Agitation	True	False	disagreement	erisk2025
6	G3TR04_909_8	Today after lunch my heart started to race and I was anxious and scared so I took one and felt fine but very drowsy.	ugh I just feeling dizzy, anxious,  panicky all the time and I fucking hate it!	Also the doc upped my meds to 30mg and I start then tomorrow.	11	Agitation	True	False	disagreement	erisk2025
6	G5xV2A_687_1	Guided meditation and visualizations have been an amazing tool for me.	I first had guided meditation exactly for this reason- anxiety was turning me into a complete insomniac.	I was in therapy at the time, and she suggested it.	11	Agitation	True	False	disagreement	erisk2025
6	G9ZO6n_35_1	So it seems like this resonates with a lot of people.	I also have anxiety, and am prone to OCD thoughts.	I dated and slept with cis guys from about 15-21.Enjoyed the feeling of penetration but it was pretty meh.	11	Agitation	True	False	disagreement	erisk2025
6	GRySZg_386_4	His mother asked that I notify all his friends and boss etc which I did, then the Dr came out to see me as I had my first ever full blown panic attack.	Since then, my anxiety has remained heightened.	I suffer regular panic attacks.	11	Agitation	True	False	disagreement	erisk2025
6	GmY6qF_36_0		Idk about you guys, but I've become more irritable and exhausted with each passing day.	I've been having some intense Braxton Hicks contractions, lots of aches and pains, and little sleep.	11	Agitation	True	False	disagreement	erisk2025
6	HKHGmV_1517_3	once i killed myblek and CT I knew all I had to do was get you, but I really thought Galimore had that return.	I was a nervous wreck for about two seconds.		11	Agitation	True	False	disagreement	erisk2025
6	Ha2cn3_16_1	Yes.	I have very bad anxiety.	I am very very paranoid.	11	Agitation	True	False	disagreement	erisk2025
