symptom_id	docid	pre	text	post	bdi_query	bdi_name	majority	consensus	type	source
7	eZ0mW0_983_13	Speaking of.	My insomnia is as follows: i have a narrow window to fall asleep and it only happens somewhere between 16 hours and 26 hours of being awake making a schedule hard to keep.	And then ill probably get woke up by my dog barking and I just cant sleep after that point.	16	Changes in Sleep	True	True	agreement	erisk2025
7	euzYRN_1121_0		I have a very weird sleep cycle.	I can't stay asleep for longer than four hours.	16	Changes in Sleep	True	True	agreement	erisk2025
7	euzYRN_1121_1	I have a very weird sleep cycle.	I can't stay asleep for longer than four hours.	I can't stay awake for more than seven or eight straight hours.	16	Changes in Sleep	True	True	agreement	erisk2025
7	euzYRN_1121_2	I can't stay asleep for longer than four hours.	I can't stay awake for more than seven or eight straight hours.	There is really little I can do about it.	16	Changes in Sleep	True	True	agreement	erisk2025
7	ewmSV3_3241_2	Mine are from a lack of sleep most likely.	For the past few months I've only been getting about 4 hours of sleep a day.	And it's split up between two to three quick naps.	16	Changes in Sleep	True	True	agreement	erisk2025
7	fDEgRE_497_5	Even in college, I'd fall asleep in almost all my lectures, but this time, my grades began to drop.	I chalked it up to not getting enough sleep at night even though I was averaging 12 hours a night and an additional 2 hours during the daytime.	Eventually, at 21, I went to go see a specialist, and I had a sleep study and MSLT done.	16	Changes in Sleep	True	True	agreement	erisk2025
7	g4Mvcs_906_0		I don't have a normal sleep schedule.	I'm always physically exhausted but get killer insomnia.	16	Changes in Sleep	True	True	agreement	erisk2025
7	goRi5c_2677_5	They didn't even own the property and had zero right to even be there, let alone take my business.	Anyways, I have a hard time sleeping now too.	That's when I can't help but think about it all.	16	Changes in Sleep	True	True	agreement	erisk2025
7	gztU9x_65_0		I think my more regular sleep schedule recently has helped me a lot too.	I havent had an episode in a few months, and even that one was less an intense than some past ones.	16	Changes in Sleep	True	True	agreement	erisk2025
7	h9uYeG_1049_2	But not because I had to.	I have a bad case of insomnia and my brain doesn't like to let me sleep.	So woohoo for all nighters_-.-	16	Changes in Sleep	True	True	agreement	erisk2025
7	h9uYeG_1979_1	Op needs to grow a heart.	I have insomnia I really don't get much sleep so I am always awake for abnormaly long periods of time.	"These ""brainless"" questions come from my brain because Im BORED."	16	Changes in Sleep	True	True	agreement	erisk2025
7	h9uYeG_3588_0		I don't sleep at night.	I sleep in classes.	16	Changes in Sleep	True	True	agreement	erisk2025
7	h9uYeG_55_1	Just turned to 1am.	And i dont sleep very often.	Im on that insomnia flow-.-'	16	Changes in Sleep	True	True	agreement	erisk2025
7	ikwH4R_242_4	and then snoozed it every ten minutes until 9:30.	I'm very sleep deprived and very agitated!	Glad there's someone I can relate to!	16	Changes in Sleep	True	True	agreement	erisk2025
7	jVyOV4_294_0		Recently I've been trying to fix my schedule, but I went too far...I fall asleep at 9 every night and wake up bright and early at 3AM every morning.		16	Changes in Sleep	True	True	agreement	erisk2025
7	jeCAL4_918_1	I just took my last final of the quarter.	For the past 11 weeks I have been getting about 2-3 hours of sleep per night.	I know how the guy feels...	16	Changes in Sleep	True	True	agreement	erisk2025
7	k1m2gD_1555_0		I'm not very good at getting to sleep		16	Changes in Sleep	True	True	agreement	erisk2025
7	k1mJOK_90_1	Nothing physical, really.	I have serious, serious insomnia though.	I also  have problems with hunching and shoulder tightness, if that counts.	16	Changes in Sleep	True	True	agreement	erisk2025
7	k7gkgT_607_1	This has happened quite recently, actually..	I have a tough time sleeping, but have figured out good routines and what not to cope with that.	But recently, I've tried wax ear plugs.	16	Changes in Sleep	True	True	agreement	erisk2025
7	kITjOR_2692_9	I sleep late, usually until someone is waking me up.	I feel exhausted, but when the night comes, I won't be able to sleep again.	It just starts all over.	16	Changes in Sleep	True	True	agreement	erisk2025
7	kITjOR_2775_0		I've been sleeping more.	About 10 plus hours.	16	Changes in Sleep	True	True	agreement	erisk2025
7	kX0OEH_292_0		I've had trouble sleeping since highschool when I would stay up late at night and play video games, getting maybe 4-6 hours a night.	Then, I started abusing amphetamines/uppers and would stay away for many days until I was nearly hallucinating.	16	Changes in Sleep	True	True	agreement	erisk2025
7	kd9SiS_90_0		I never sleep.		16	Changes in Sleep	True	True	agreement	erisk2025
7	kxid9A_104_5	I was taking cold showers, doing cardio (spinning), run (last time in cold rain, it definitely did not help), all this on slightly calorie deficit diet.	I did not get enought sleep in weeks.	Stressfull personal life (I am sorting things up) did not help either.	16	Changes in Sleep	True	True	agreement	erisk2025
7	lCpjT2_239_18	I workout in the mornings generally before 12 PM.	I get 7-8 hours of sleep.	I spend my time studying so exercising and studying is all I do, so I'm otherwise sedentary?	16	Changes in Sleep	True	True	agreement	erisk2025
7	lhklvm_45_13	I have not woken up with out a stuffed up nose in weeks.	I can't sleep because I pee all the time.	Oh yeah and preggo dreams are fucking horrible.	16	Changes in Sleep	True	True	agreement	erisk2025
7	lhklvm_85_1	I'm tired.	I can't sleep through the night again.	I hate my favorite foods.	16	Changes in Sleep	True	True	agreement	erisk2025
7	ltKaGB_541_0		My sleep schedule has been crazy over the last month or so.	Last night, I actually went to sleep around 12:30am and woke up today around 8:30am.	16	Changes in Sleep	True	True	agreement	erisk2025
7	mEyadO_33_0		My sleep pattern is totally deranged and I've tried any number of things to drift off.	Even though I'm absolutely exhausted I just don't sleep and it's effecting my day to day life.	16	Changes in Sleep	True	True	agreement	erisk2025
7	mTwq7B_18_10	He seems to only read the MtF transformation erotica and I cycle between being fine with it and just wanting to help him figure out what level of impact this will have on our sex life, to feeling hurt and sad that he kept this from me, to being scared that he's transgender and suffering alone, and on it goes.	I literally cannot sleep some nights because I'm so stressed about it.	I found one story that he downloaded and one that he wrote in the first person.	16	Changes in Sleep	True	True	agreement	erisk2025
7	mxOrbn_497_8	Also make sure your room is pretty cold.	I've found I get much better sleep and sleep all the way through the night.	4.)	16	Changes in Sleep	True	True	agreement	erisk2025
7	nn0FeP_1614_16	1-2am attempt to sleep.	I developed insomnia during college with around 3-4 hours sleep, as I've gotten older that has grown longer.	Now I'm happy with 5-7 hours sleep, occasionally less.	16	Changes in Sleep	True	True	agreement	erisk2025
7	nn0FeP_1614_17	I developed insomnia during college with around 3-4 hours sleep, as I've gotten older that has grown longer.	Now I'm happy with 5-7 hours sleep, occasionally less.		16	Changes in Sleep	True	True	agreement	erisk2025
7	nszZrs_100_5	I am most active, both physically and mentally, at night and try to get into work at the latest time possible I am allowed (9am).	I typically get 7-9 hours of sleep a night.	I work out at 7pm and usually get the best workout then too.	16	Changes in Sleep	True	True	agreement	erisk2025
7	nszZrs_3568_15	I can't pull all nighters, almost ever.	I have a sleeping disorder so I sleep a really weird schedule.	All nighters were a regular occurrence.	16	Changes in Sleep	True	True	agreement	erisk2025
7	nszZrs_4692_0		I'm usually up all night.	Is this not relevant?	16	Changes in Sleep	True	True	agreement	erisk2025
7	nszZrs_490_4	I usually take a nap for a few hours after work.	So I sleep a split schedule and actually feel much better than any 8-10 sleep schedule I have ever had.		16	Changes in Sleep	True	True	agreement	erisk2025
7	nszZrs_5287_3	5 hours a sleep a night has been what I've been getting recently.	I usually sleep like 12 hours the day after my last day of the work week.	But I get 3 days a week off so I love it.	16	Changes in Sleep	True	True	agreement	erisk2025
7	nszZrs_5434_0		I have such problems getting to sleep i usually go to sleep at 8am and wake up at 4pm.	Which works fine with me.	16	Changes in Sleep	True	True	agreement	erisk2025
7	odQmUX_162_0		I've had issues with sleeping for a while, but a recent change has literally doubled my average number of hours from 4 to 8.	I got up to 12 hours the other day!	16	Changes in Sleep	True	True	agreement	erisk2025
7	olsNfe_1465_11	I got 5 hours sleep, that was Sunday 12th June (yesterday) That was 20 hours ago.	In the last 16 days I've had a grand total of 39 hours of sleep, and I've been awake over 340 hours... I'm genuinely worried by this now.	Does anyone else get insomnia to this extent?	16	Changes in Sleep	True	True	agreement	erisk2025
7	olsNfe_1465_8	I didn't sleep again for 106 hours; the longest I've ever gone as far as I can remember.	I finally got 3 hours sleep Wednesday 8th of July, and a solid 10 hours sleep on Thursday 9th of July... my only decent nights sleep this month.	After that I spent 43 hours awake until 5am on Sunday morning.	16	Changes in Sleep	True	True	agreement	erisk2025
7	oq11BX_1078_57	I have *zero* free-time.	I get to sleep maybe four hours a night.	I don’t get to binge on Netflix.	16	Changes in Sleep	True	True	agreement	erisk2025
7	pWCgOz_3423_1	Well I envy the amount of sleep you get at least.	I get half that much sleep a night.		16	Changes in Sleep	True	True	agreement	erisk2025
7	ppnr3x_696_0		I sleep on average 4 to 5 hours a day.	I work night shift.. My sleep time is maybe 6 am to 10am or 11 am usually	16	Changes in Sleep	True	True	agreement	erisk2025
7	q0Jshp_276_20	I only work casually.	I sleep most of the time because that's all I can bear to do.	I'm tired all the time; I can't concentrate on anything that makes me happy.	16	Changes in Sleep	True	True	agreement	erisk2025
7	qXVrPO_775_0		I'm under pretty heavy sleep medication at night because it takes me up to two hours to fall asleep sometimes.	I'm very curious of the answer to this.	16	Changes in Sleep	True	True	agreement	erisk2025
7	qkArDH_349_2	I could sleep through a lot.	The last two nights I've been waking up and cannot get back to sleep.	I'm not having caffeine later, if anything I'm having less in general.	16	Changes in Sleep	True	True	agreement	erisk2025
7	r1xcyj_235_5	I am just ALWAYS so tired.	I don't sleep well, but even when I do, I'm tired.	If I try to stay active during the day I'm like a zombie walking around.	16	Changes in Sleep	True	True	agreement	erisk2025
7	r1xcyj_767_7	But nice to feel so not alone right now.	I can't sleep either.	I've had nightmares a lot in the past, which is frustrating to deal with as an adult, but I dread going to sleep and having more dreams about trying to wake up my dead mother.	16	Changes in Sleep	True	True	agreement	erisk2025
7	r7EWsQ_895_4	But she is a terrible sleeper.	If I get 4 hours straight of sleep, it is amazing.	Naps are ridiculous and take tremendous effort from me usually.	16	Changes in Sleep	True	True	agreement	erisk2025
7	rH5TV3_3647_0		I used to have a lot of trouble getting to sleep.	Then I changed my habits and now I manage to go right to sleep at the same time every night.	16	Changes in Sleep	True	True	agreement	erisk2025
7	rXIoYt_55_33	I can't imagine meeting anyone like him again, in fact I know I won't, everyone said he was one in a million, and he's left a massive hole in all our lives that can't be filled.	I'm having trouble sleeping, and when I do sleep my dreams are weird and confusing and wake me up.	I just can't believe that in the space of a couple of months he's gone from being happy &amp; outgoing and active to ill, to really ill, to dead.	16	Changes in Sleep	True	True	agreement	erisk2025
7	raMnnw_1048_4	Now it's saturday morning and I didn't sleep last night, too.	I am tired, I just cannot make myself sleep.		16	Changes in Sleep	True	True	agreement	erisk2025
7	remFA0_79_6	Brain fog is substantially reduced - I haven't been able to think this clearly in a while.	* My sleep schedule is really messed up.	I sometimes go to bed as late as 3am, but I still have a lot more energy throughout the day no matter how many hours I sleep.	16	Changes in Sleep	True	True	agreement	erisk2025
7	sDAPnD_401_0		I have chronic insomnia which sometimes nights in a row causes night terrors.	I have sadly dealt with this fear with alcohol, as that with my sleep medications will make me not remember my night terrors.	16	Changes in Sleep	True	True	agreement	erisk2025
7	sLRn6q_965_3	I am so serious.... I get so, SO tired at like 10:30 these days.	I sleep the entire night etc.	I fall asleep within a few minutes to an hour at worst.	16	Changes in Sleep	True	True	agreement	erisk2025
7	tEBPp1_3645_5	I use the energy I'm stuck with in as positive a way as I know how, and it comes off as fun - I guess - but it's not fun.	I can't sleep, then when I do I have problems waking up.	I've got lots of free time, cars and most everything else is paid off, a very supportive and loving wife, friends who respect me, and a relative stress-free life.	16	Changes in Sleep	True	True	agreement	erisk2025
7	tGDaeR_379_40	The day after I completely alienated my best friend.	I hadnt slept more than a few hours a day in weeks and weeks.	I thought it was my medicen.	16	Changes in Sleep	True	True	agreement	erisk2025
7	tVp8zd_110_1	I feel you.	I cant sleep anymore more than 2-3 hours.	I swear I somehow function normally, but I used to sleep 8-9.	16	Changes in Sleep	True	True	agreement	erisk2025
7	u3OAkS_70_0		I often have problems sleeping before the time I'm used to go to bed (usually around 2AM).	Then one day I came to a site that explained how to have out-of-body-experiences.	16	Changes in Sleep	True	True	agreement	erisk2025
7	uCnB5o_73_1	I was going to say 15lb for a bed roll is way too much for me to carry it around.	Besides I hardly ever sleep anyway.	And isn't it useless in hard core?	16	Changes in Sleep	True	True	agreement	erisk2025
7	uGo3rF_1606_0		Day off, didn't leave my bed at all and slept through most of the day.	My life is so sad...	16	Changes in Sleep	True	True	agreement	erisk2025
7	uso463_1364_5	13-15 Hours, 0 breaks.)	Plus, with my sleep, or rather lack of sleep schedule, means i could be easily up for 40-50 hours, and only sleep 3 days during the week.	I Think you now start to understand how i put 6300 Hours into skyrim, Right?	16	Changes in Sleep	True	True	agreement	erisk2025
7	vDTYSQ_955_2	If we watch something on the laptop, or have sexy times before it's time to go to sleep, I usually pop another for good measure.	I will say though, I was sleeping up to 12 hours a day.	I notice that this week, it's down to 7.5 or so.	16	Changes in Sleep	True	True	agreement	erisk2025
7	vEVzQ6_1528_1	Well good morning!	My sleep is all over the place these days.	Damn drugs.	16	Changes in Sleep	True	True	agreement	erisk2025
7	vedfgi_212_1	How little they sleep and can still function at their optimal.	I've had some pretty debilitating insomnia for the last three years and I welcome any amount of sleep.		16	Changes in Sleep	True	True	agreement	erisk2025
7	vedfgi_216_1	I work a pretty high-stress job full time at random hours of the day.	I've had sleep issues for the last three years and I rarely if get beyond 4+ hours of patchy sleep.	If I do get a decent amount of sleep it's riddled with nightmares, waking up randomly with a sense of unease, or woken up by the environment (dogs, things crashing in the night, SO waking up at random times of night for work, my face feels slightly itchy, etc.)	16	Changes in Sleep	True	True	agreement	erisk2025
7	vqh2fM_25_0		I'm having trouble sleeping at the moment, and when I get to bed I find myself laying there for up to an hour sometimes before I finally dose off.	Does anybody have any tips for falling asleep?	16	Changes in Sleep	True	True	agreement	erisk2025
7	wFDCNG_738_0		I think I only get like 25 hours of sleep per week. :-/		16	Changes in Sleep	True	True	agreement	erisk2025
7	wV4LbM_8_16	This next part I tend to struggle with, because I can't find an explanation for it.	Along with my inability to fall asleep, I also tend to wake several times throughout the night.	So, one of these times I opened my eyes, saw that my room was still dark and instantly remembered the Shadow Man.	16	Changes in Sleep	True	True	agreement	erisk2025
7	wWQ2wc_670_0		I can't sleep either, insomnia sucks!		16	Changes in Sleep	True	True	agreement	erisk2025
7	wn9Trg_5496_1	That all pisses me off.	I have severe problems with insomnia, it doesn't matter how busy or not I am, sometimes I just am unable to sleep for a couple days.	My record was 5 days.	16	Changes in Sleep	True	True	agreement	erisk2025
7	wzglJq_458_1	I've been trying to get into a workout routine but I'm hitting a roadblock in regards to my motivation and energy level.	I have issues sleeping so I take 6mg of melatonin each night.	This works great for getting me to bed and I feel fine on the days I get to sleep in as late as I want but when I have to forcibly wake myself up early I get stuck in this cloud of lethargy and apathy where I have no energy to do anything and no motivation to even try.	16	Changes in Sleep	True	True	agreement	erisk2025
7	xFTd2n_379_4	random expenses coming up.	my sleep quality has gone down the drain.	work has been an absolute nightmare.	16	Changes in Sleep	True	True	agreement	erisk2025
7	xFTd2n_601_2	Me?	I always sleep like crap.	Anytime I go a long run or a harder run and almost always sleep really bad that night.	16	Changes in Sleep	True	True	agreement	erisk2025
7	xHDwW6_696_1	I spent most of Saturday sleeping, honestly.	I haven't been getting the best sleep this past week.	Then I went out and did some errands before sorting my jewelry-making supplies, making a necklace, and doing laundry... all without children to get in the way.	16	Changes in Sleep	True	True	agreement	erisk2025
7	xMKUT5_1194_0		I haven't been getting alot of sleep in the last few days.	Traveling from my parents to my in-laws and sleeping on couches makes me a bit out of it.	16	Changes in Sleep	True	True	agreement	erisk2025
7	xnaWlq_1831_5	* See past posts.	I have insomnia.	So instead of reading on reddit at night I have picked up minecrafting.	16	Changes in Sleep	True	True	agreement	erisk2025
7	xstQjZ_669_1	Hello.	I regularly sleep less than 4 hours.		16	Changes in Sleep	True	True	agreement	erisk2025
7	y1aU4Q_263_5	This has only gotten worse as I started my first professional full time job.	I get to bed by 11pm every night, and wake up at 6:50, and I'm still rundown a large majority of the day.	I'm scared that I will just never be energized and that it'll just always be like this and it's honestly miserable.	16	Changes in Sleep	True	True	agreement	erisk2025
7	yIiQiu_514_1	Haha did not even realize.	I'm running on very little sleep due to my manic state.		16	Changes in Sleep	True	True	agreement	erisk2025
7	yUwAFk_353_6	Since he suggested the time off, sounds like he's pretty understanding - maybe he's open to trusting your doc saying your judgment and moods are stable again and giving you back your regular duties once youve gotten back on track?	I know what you mean about the sleep... I cant stay awake during the day, and I cant sleep at night.	I did on the first night on my new meds, but thats it.	16	Changes in Sleep	True	True	agreement	erisk2025
7	yfOuhv_22_1	I'm trying to kick my dependency on adderall, and I am constantly tired because of it.	I've been doing a lot of sleeping which just leads to me feeling even worse.	group hug anyone?	16	Changes in Sleep	True	True	agreement	erisk2025
7	ymGaA3_668_3	And I see it.	I don't sleep well anymore.		16	Changes in Sleep	True	True	agreement	erisk2025
7	yoxFaK_286_0		Sleep late, my sleep schedule is out of control.		16	Changes in Sleep	True	True	agreement	erisk2025
7	yspGly_4603_1	I personally have what I call a cyclical insomnia.	I may sleep well for a week or a month but I find that if I can't sleep one night it becomes harder and harder to get to sleep until sometimes I maybe be up for three or four days with no sleep.	I try not to take it all the time though because yes there is a tolerance and (benzos are one of the few drugs you can actually die withdrawing from).	16	Changes in Sleep	True	True	agreement	erisk2025
7	ywcufZ_715_3	2.	I am nocturnal, I rarely am on a good sleep schedule.	3.	16	Changes in Sleep	True	True	agreement	erisk2025
7	z1TPXt_728_0		I've tried adjusting my sleep schedule many times but have always failed.	I typically fall asleep around 3-4 in the morning which means waking up at 9:00 is painful.	16	Changes in Sleep	True	True	agreement	erisk2025
7	z1TPXt_747_0		Monday through Thursday, I drag myself out of bed at 9am, invariably exhausted because I don't seem to be sleeping properly.	I rush through my morning routine of shower, dress, skip breakfast, stress out and leave by 9:40.	16	Changes in Sleep	True	True	agreement	erisk2025
7	z8nc6x_8625_1	I get a lot of naps.	I sleep maybe 3 hours.	Work, come home, nap.	16	Changes in Sleep	True	True	agreement	erisk2025
7	zIivMl_708_2	Then I fall asleep to a nightmare and wake up in the middle of the night to continue building upon my perfect world until I either fall back asleep or its time to get up.	Fortunately I sleep a lot.	It's all I can really bring myself to do.	16	Changes in Sleep	True	True	agreement	erisk2025
7	zr0hr6_63_3	Seen one kid three times (18-20yo, probably a local), a middle aged black guy, and older Hispanic guy (who I had chased off when he was casing the neighbor's place).	I rarely sleep.	Every car around here (including all my neighbors, and their neighbors) that isn't garaged has been broken into at least once in the last three years.	16	Changes in Sleep	True	True	agreement	erisk2025
8	0DDp3b_115_2	What happens with me a lot is that I'll hear my phone vibrate or go off when I'm busy, take a quick peek to see what it is, and then completely forget because I go back to whatever I was busy with.	I get distracted and won't respond for longer than normal.		19	Concentration Difficulty	True	False	disagreement	erisk2025
8	0RMSDL_1925_0		My problem is I'm so all over the place I can't focus on it.	I want desperately to play, but when I sit down to play I get restless within an hour.	19	Concentration Difficulty	True	False	disagreement	erisk2025
8	16Jn2Z_256_7	I had gained weight.	I was not able to focus.	I really missed the mania.	19	Concentration Difficulty	True	False	disagreement	erisk2025
8	1akLKx_206_2	I use an ani/oxi mix though, with some Alpha-GPC.	I just feel like I'm able to grasp concepts easier and focus for much longer.	I take it on an empty stomach.	19	Concentration Difficulty	True	False	disagreement	erisk2025
8	2BjZfC_2008_1	You are definitely welcome!!!!	I can't even focus anymore!!		19	Concentration Difficulty	True	False	disagreement	erisk2025
8	2ZQAaJ_4568_2	There is something down there emitting a high pitched screaming sound.	I don't know what it is, so I can't fix it, but it's so bad that I can't concentrate.	When you factor in my kitten wanting to be pet, it's torture.	19	Concentration Difficulty	True	False	disagreement	erisk2025
8	3DGBvY_359_3	I suck it up for some exercises, but lunges  are not one I can do.	I think it's because I have to focus so much.	It's not like running where I can zone out and go for an hour or so.	19	Concentration Difficulty	True	False	disagreement	erisk2025
8	3fs0dk_380_0		I have tried, my problem is that I become interested in way too many things at once, so I can never concentrate on one task, whatever it may be.	I want to know everything, it's really a curse.	19	Concentration Difficulty	True	False	disagreement	erisk2025
8	3hgU9N_1858_3	I feel awesome on keto.	My mental clarity is vastly improved.	My energy levels are through the roof.	19	Concentration Difficulty	True	False	disagreement	erisk2025
8	4Z0Hsu_715_5	One of my mates had a fierce anger problem, but bitta therapy and he's a new man, way more relaxed and happy.	Meditation is supposed to be the business, but I cant concentrate for long enough, myself.		19	Concentration Difficulty	True	False	disagreement	erisk2025
8	4lYXmI_7_0		I never get anything done anymore		19	Concentration Difficulty	True	False	disagreement	erisk2025
8	54c7QV_271_0		I already have a hard enough time concentrating as it is, i would not be able to work like that.		19	Concentration Difficulty	True	False	disagreement	erisk2025
8	5hnoct_244_1	I know a lot of people, including myself, find exercising (especially on a treadmill) terribly boring.	I find myself constantly looking at the timer and not being able to focus fully on something else like a podcast, music, television, ect.	For those who have been in a similar situation and now really enjoy being present in their exercising, what did you do?	19	Concentration Difficulty	True	False	disagreement	erisk2025
8	5u3OPN_105_1	I am seriously dying for that kickoff.	I can't concentrate on work anymore.	Go United!	19	Concentration Difficulty	True	False	disagreement	erisk2025
8	60ghM5_67_1	I've tried to learn Italian (and a bit of German) by myself before, but I ended up giving up, haha.	I get too distracted!	Yeah, it'd be cool to have a Brazilian equivalent to reddit. :&	19	Concentration Difficulty	True	False	disagreement	erisk2025
