symptom_id	docid	pre	text	post	bdi_query	bdi_name	majority	consensus	type	source
1	1xwBvT_2942_1	Dude, I had the same problem last week and I just ended up giving up after 5 pairs and telling my sister to buy some underwear.	It was basically I CAN'T MAKE ANY MORE DECISIONS!	YOU BUY UNDERWEAR!	13	Indecisiveness	True	False	disagreement	erisk2025
1	1xwBvT_3676_3	That was like a month ago.	I can't handle the pressure of decision making.		13	Indecisiveness	True	False	disagreement	erisk2025
1	29ow0p_587_9	I've never liked being told what to do, and I don't plan on ever starting.	I believe that I make my own choices in life, and the things I choose to participate in are up to me.	Happiness is a choice, love is a choice, and homosexuality is a choice.	13	Indecisiveness	True	False	disagreement	erisk2025
1	2Htq70_257_33	*I.. what?	I didn't want to make the decision, but I had to.	I couldn't keep the baby, I have no money, no family, nothing at all.	13	Indecisiveness	True	False	disagreement	erisk2025
1	2UpdyE_846_4	I am neither for nor against abortion.	I do not know nor do I make a choice.		13	Indecisiveness	True	False	disagreement	erisk2025
1	2ZQAaJ_267_2	Not even just sexually, but in my daily life, I become much more impatient, irritated, and impulsive.	I make ridiculous purchases and decisions.	It's not pretty.	13	Indecisiveness	True	False	disagreement	erisk2025
1	2m1MVj_467_3	but there must be a way where i can make myself more decisive and play the champions that i should be playing.	to be honest, just in general i need more decisiveness, the amount of mistakes i have made through inaction is incredible.		13	Indecisiveness	True	False	disagreement	erisk2025
1	4A0O7n_5486_17	I just stopped all contact.	I knew it was the right decision and I just did it.	I felt peace after doing so and saw the therapist for about two months.	13	Indecisiveness	True	False	disagreement	erisk2025
1	4oS0xr_254_2	So, two years ago I basically did this.	Best decision I ever made.	I had a college degree and was working for the world's largest environmental non-profit, making good money and generally enjoying life but feeling like I needed to experience something else.	13	Indecisiveness	True	False	disagreement	erisk2025
1	5Od7mW_1070_1	This is mine too.	I didn't make the best decisions because I was too worried about what other people would think about me.	In retrospect, their opinions didn't really matter and now I am set back by not taking advantage of those opportunities.	13	Indecisiveness	True	False	disagreement	erisk2025
1	5ZoqiK_649_1	Not really.	I'm just indecisive.		13	Indecisiveness	True	False	disagreement	erisk2025
1	5aDzBx_629_2	Im just going to take bits and pieces of everyones advice since you all had some pretty intelligent things to say.	I have a big decision to make now and its looking to be a pretty difficult one.		13	Indecisiveness	True	False	disagreement	erisk2025
1	6D2fAt_1062_0		I am worried about what the right thing to do is.	I will be an adult soon, and in an adult world.	13	Indecisiveness	True	False	disagreement	erisk2025
1	7emzeK_169_1	Um no.	I'm capable of making my own decisions.	I happen to think every single LPT post's top comment is better than the post itself.	13	Indecisiveness	True	False	disagreement	erisk2025
1	7wQHdF_469_1	Sorry, I dont get my opinions from culture.	I make my own decisions.		13	Indecisiveness	True	False	disagreement	erisk2025
1	8NZ4Bg_104_0		I've been conflicted with a lot of life path choices this past week.	Some of them are simple things, but there are some I'm not comfortable discussing in public.	13	Indecisiveness	True	False	disagreement	erisk2025
1	8a7vlk_741_8	Having a discussion about the merits of labor is a good start.	I'm unabashedly uncapable of deciding what is right for anyone outside of me.	None outside of me, could know better for me.	13	Indecisiveness	True	False	disagreement	erisk2025
1	8g7v71_1331_0		I cant take these decisions anymore		13	Indecisiveness	True	False	disagreement	erisk2025
1	AbiwVB_4788_28	Thank you so much for any answers you can offer!	I need to make a decision by tomorrow and I just don't know what to do!!		13	Indecisiveness	True	False	disagreement	erisk2025
1	AcdnNQ_62_9	Well, it speaks for itself.	I can't make up my mind whether it was a good decision or not.		13	Indecisiveness	True	False	disagreement	erisk2025
1	ApGrpE_1173_2	After eight months he dumped me over a phone call.	I went into meltdown mode, and I was on the way to making worse and worse decisions.	I was using a dating app to meet new guys to give myself someone to hang out with and also as a snub to my ex that I was already seeing other people.	13	Indecisiveness	True	False	disagreement	erisk2025
1	B4R8kM_494_2	If my family dared lie to me, I'd be pissed.	I want to make my own choices.	Sounds like you made those choices for her, and I'm very glad it worked out that well.	13	Indecisiveness	True	False	disagreement	erisk2025
1	BfIkU0_11_25	Maybe I'm becoming more cynical, maybe I'm becoming more realistic.	But I still remain indecisive.	So that's the background story about how I came to ask this question.	13	Indecisiveness	True	False	disagreement	erisk2025
1	BfIkU0_16_24	Maybe I'm becoming more cynical, maybe I'm becoming more realistic.	But I still remain indecisive.	So that's the background story about how I came to ask this question.	13	Indecisiveness	True	False	disagreement	erisk2025
1	CY9Ld4_1607_4	"Some of my friends are like ""You need to tell him he can't see her anymore and protect her."""	Still, I feel like i'm making the right choice.		13	Indecisiveness	True	False	disagreement	erisk2025
1	DpHE60_237_13	After a few minutes, he told me he was going to bed and I begged him to stay.	I got really confusing and indecisive... even confused myself.	He got a little upset and said I was confusing him.	13	Indecisiveness	True	False	disagreement	erisk2025
1	GJoJLL_884_6	EDIT2: And now that one's gone too.	Damn my indecisiveness.	EDIT3: IT CAME BACK!	13	Indecisiveness	True	False	disagreement	erisk2025
1	H2D7Zh_2930_46	Maintain that frame.	There were times when I was tired of making all the decision.	Resented my wife for not being able to make a simple decision.	13	Indecisiveness	True	False	disagreement	erisk2025
1	HG0CI3_521_7	"I notice patterns and ""stories"", and the ""forest"", not the trees."	I'm definitely a T in most of my decisions.	I'm also very much a P. I never finish anything, I have more fun planning to do stuff than actually doing it.	13	Indecisiveness	True	False	disagreement	erisk2025
1	IKNgTH_129_9	We've been going to longer and longer periods of time over the last two years to make sure it's what we want.	I'm confident it's the right choice for us.	"As far as not wanting ""white folk"" there, neither I, nor my family and other friends I already have over there have ever encountered that kind of attitude."	13	Indecisiveness	True	False	disagreement	erisk2025
1	MhVky7_846_3	It drains me all the time, but it's a useful function for an INFP, I find, because it helps you put your feelings and idealizations to use.	I find I make the best decisions when I consider both my feelings and logic.	That's why I'm also great at debate.	13	Indecisiveness	True	False	disagreement	erisk2025
1	Mzl1W7_9_4	"When something unexpectedly goes wrong and the normal solution is unavailable, I can get ""stuck""."	I can't make a decision one way or the other.	For example, on one occasion the bread that I wanted to buy wasn't available and I didn't like anything else that they had.	13	Indecisiveness	True	False	disagreement	erisk2025
1	N7X2d6_382_1	If you dont mind telling me, which cards did you side out/in during each match up?	I get nervous side sometimes because i dont want to make a bad choice		13	Indecisiveness	True	False	disagreement	erisk2025
1	N7fwT1_132_5	I have decided that I need to stop beating myself up for these decisions but instead take notes from them for next time.	Now this is tough to do as I have anxiety and can't help but to tear myself apart because of bad decisions I made(any advice would be lovely).	I know that I have to be strong for my 2 little sisters and be the person they look up to.	13	Indecisiveness	True	False	disagreement	erisk2025
1	NeeufV_914_3	So I did a little research and through trial and error I moved to the highest population horde server on the east coast (at that time).	It was the best decision I ever made.	WoW became a whole new game.	13	Indecisiveness	True	False	disagreement	erisk2025
1	NofUBW_1665_7	Sexy and mean vs cool and interesting, really.	I struggle with this decision damn near every time.		13	Indecisiveness	True	False	disagreement	erisk2025
1	OaZzwU_2201_1	I fled the US seven or eight years ago when the bush gang was going to be re-elected.	Best decision in my life.		13	Indecisiveness	True	False	disagreement	erisk2025
1	OaZzwU_2565_2	I have lived my life as I thought best.	I make all of the decisions about my present and my future.	I used to drift into and out of reality.	13	Indecisiveness	True	False	disagreement	erisk2025
1	OqM4zg_13_6	I'm asking because I got about 5 1/2 hours of of sleep last night and just finished doing my sprint workout.	This type of decision is a constant struggle for me each week.	Thanks!	13	Indecisiveness	True	False	disagreement	erisk2025
1	QD63BG_1973_6	I can wash my dishes in my own order.	I'm enjoying the chance to make my own choices.		13	Indecisiveness	True	False	disagreement	erisk2025
1	QKvbma_727_0		at this point my gut is totally apathetic and yet too busy hating everything about myself, so I'm not sure how great I am at making decisions right now.		13	Indecisiveness	True	False	disagreement	erisk2025
1	Qpyp52_2834_1	You act as if I do not know that.	It is my decision to make not because I am equipped to make the decision but because I can make the decision and I will.		13	Indecisiveness	True	False	disagreement	erisk2025
1	RPPE1A_2441_0		am I just not good at making life decisions?	how can I get better at that?	13	Indecisiveness	True	False	disagreement	erisk2025
1	ScH9dD_7_3	He was unplanned and I picked out his parents and went through the same agency as cate and ty.	Best decision I ever made.	Idk why they didn't do that with jace, he doesn't need to be with Barbara or Jenelle	13	Indecisiveness	True	False	disagreement	erisk2025
1	TSQfKz_121_16	- I'm terrible at expressing emotions when I do have to, as my best friend would put it, I have the perfect resting bitch face - I look like I'm staring daggers half the time.	- I take forever to make a decision but when I do, I stick with it.	- I also take forever to decide if I like someone.	13	Indecisiveness	True	False	disagreement	erisk2025
1	TTTyjT_291_11	I made about 5 dollars in 8 hours.	I suck and make bad decisions.		13	Indecisiveness	True	False	disagreement	erisk2025
1	Tf6CQR_185_3	Ugh.	I make great life choices.		13	Indecisiveness	True	False	disagreement	erisk2025
1	TpVO2H_761_1	I think about number one all the time.	I'm 25 and at the point where I am constantly having to make major decisions that will change the trajectory of my life forever.	get married- yes or no.	13	Indecisiveness	True	False	disagreement	erisk2025
1	U05S3m_1000_22	I have zero regrets about not going to secondary schooling.	I feel I've made the right choice.		13	Indecisiveness	True	False	disagreement	erisk2025
1	U05S3m_490_52	I just don't know what to do.	I want this decision to be made for me.	I need to decide fast because I don't want her to go on another date with this guy but she can't keep waiting for me to come up with a decision.	13	Indecisiveness	True	False	disagreement	erisk2025
1	UkXqEP_217_1	Just turned 25 two weeks ago, can not for the life of me figure out what I am doing.	Part of the problem is that I am terrified of making the wrong decision.	I also figured out that I do not like accounting (the thing I went to school for and the job that I currently have) one fucking bit.	13	Indecisiveness	True	False	disagreement	erisk2025
1	VOyhCc_950_2	What would you plant in it?	I'm suffering major indecision.		13	Indecisiveness	True	False	disagreement	erisk2025
1	ViMbE5_77_3	It doesn't appeal.	I wouldn't feel confident about any decisions I would make.		13	Indecisiveness	True	False	disagreement	erisk2025
1	W5yrFG_0_9	Im just worried I may regret the decision to stay with him in the future.	I'm having a hard time deciding what I want more.	I worry that Im to old to start looking for someone new and go through the whole dating then marriage thing again.	13	Indecisiveness	True	False	disagreement	erisk2025
1	WSyASq_37_0		I am comfortable with my decision.	I am not satisfied with the results.	13	Indecisiveness	True	False	disagreement	erisk2025
1	XOPGvA_138_7	Physically after surgery, I'm not going to lie.	I questioned my decision.	It sucked.	13	Indecisiveness	True	False	disagreement	erisk2025
1	YA5YOr_151_7	It has been a terrible summer for me and you haven't been there.	I am sick of having to decide everything all the time.	Grow up and make your own decisions.	13	Indecisiveness	True	False	disagreement	erisk2025
1	YZE91B_2411_0		indecision is killing me		13	Indecisiveness	True	False	disagreement	erisk2025
1	a8sbhG_1446_1	Not gonna lie, I totally would.	Then again I am not known for making the best choices in life...		13	Indecisiveness	True	False	disagreement	erisk2025
1	aOJuy1_1112_0		I am also indecisive and will be getting both.		13	Indecisiveness	True	False	disagreement	erisk2025
1	bSd5aX_242_1	Dude, juice can be very stressful.	I sometimes have a hard time making choices and juice is a tough choice.	Lemonade or grapefruit?	13	Indecisiveness	True	False	disagreement	erisk2025
1	cM2scZ_172_0		ITT: making me question all the decisions i've made in life		13	Indecisiveness	True	False	disagreement	erisk2025
1	cz6hTb_2312_10	Because this is the internet, you're someone I don't know, and I don't give a fuck if you think I'm a bitch for being aggressive.	"I don't have trouble making decisions, but in the real world I may find it challenging to express them due to that lingering thought that someone may find me ""unladylike"" for doing so."	"I don't wish to adhere to standards of perfect ""ladylike""-ness, but when you're raised in a culture that values passiveness in its women, it's not easy to break completely free of that mindset."	13	Indecisiveness	True	False	disagreement	erisk2025
1	dlDLbw_1962_2	8 years?	Obviously I don't have the mind or belief system to make good decisions.	Yea...	13	Indecisiveness	True	False	disagreement	erisk2025
1	dlDLbw_2233_54	I am not alone.	I am consciously deciding to change without knowing the results.	I am truly happy, despite the doubt and transient hallow feeling.	13	Indecisiveness	True	False	disagreement	erisk2025
1	eiqPtI_442_3	conversations for the next year and a half until I go to college.	I don't know, I guess eventually I'll realize I made the right decision, but right now I just can't see it and it sucks.		13	Indecisiveness	True	False	disagreement	erisk2025
1	ff2L3F_1746_2	I thought I did, then I started not to... but then I'm doubting if it's just lazyness/apathy/fear that is making me not want them.	I don't want to regret my choices (whichever one I end up doing) later on, but how can I know what choice to make?		13	Indecisiveness	True	False	disagreement	erisk2025
1	gztU9x_785_0		I have the same decision to make... really unsure.		13	Indecisiveness	True	False	disagreement	erisk2025
1	i1Klzx_4887_1	It was petty according to her because she occupied a different reality.	I think I made the correct decision.		13	Indecisiveness	True	False	disagreement	erisk2025
1	iyKEQ4_1136_2	Just need more time to get some combos going but I think I'm doing great.	I think I made the right decision.		13	Indecisiveness	True	False	disagreement	erisk2025
1	jvWiSY_1508_2	My life is a lot richer when I don't have to numb empathy in order to justify my behavior.	A lot of times in my life, I feel uncertain about whether or not I'm doing the right thing.	I'm certain about the ethical arguments in favor of veganism, and it feels nice to have that certainty 3 times a day (whenever I eat).	13	Indecisiveness	True	False	disagreement	erisk2025
1	lE2J52_2620_4	This way is much more peaceful to me.	Thinking that I will have to make this decision every day makes me feel anxious.	I guess everyone is different.	13	Indecisiveness	True	False	disagreement	erisk2025
1	mR9stN_29_0		I think I'm gonna go with the first one.	I'm very confident in my decision.	13	Indecisiveness	True	False	disagreement	erisk2025
1	mR9stN_29_1	I think I'm gonna go with the first one.	I'm very confident in my decision.	Hot Rod/Lonely Island viewing party at my house.	13	Indecisiveness	True	False	disagreement	erisk2025
1	ntc1fL_750_3	"It's hard for me because I'll do really good some matches and then horrible the next time, and I'm left wondering if it's the ""right"" god to play."	I'm indecisive anyway so that doesn't help.	But, getting a good you seem to have a knack for and that you enjoy playing is the main key.	13	Indecisiveness	True	False	disagreement	erisk2025
1	qJzCmK_380_1	Absolutely.	I make awesome decisions.		13	Indecisiveness	True	False	disagreement	erisk2025
1	qLupEG_346_13	"She kindof got wide eyed and had a look of ""I'm so sorry"" about her."	So I feel it's the right decision.	Go get em done!	13	Indecisiveness	True	False	disagreement	erisk2025
1	sZfao5_214_1	Other people.	I have trouble understanding my own decisions most of the time.		13	Indecisiveness	True	False	disagreement	erisk2025
1	uAY0Hr_2069_2	And I'm interested in, well, I don't know yet, haha.	I'm still deciding.		13	Indecisiveness	True	False	disagreement	erisk2025
1	uDpSX2_512_2	Came back to see if things had changed, thankfully people with positive anecdotal stories showed up and are being upvoted.	I honestly couldn't make a decision unless I was actually confronted with the decision.	I just chose to ignore a hypothetical situation and don't commit either way.	13	Indecisiveness	True	False	disagreement	erisk2025
1	uxtGCV_36_1	I broke my arm, neck, and got a skull fracture in a bad car accident.	I had no one around to make decisions for me.	The entire staff did a very poor job at sharing information with me about just how severe my broken neck was.	13	Indecisiveness	True	False	disagreement	erisk2025
1	vFdomr_1505_4	I didn't like that I couldn't control the other cars and that I knew that I was a very confident person when I was driving.	I didn't trust myself to make the right decisions.		13	Indecisiveness	True	False	disagreement	erisk2025
1	x8gal1_832_2	I lived in NJ basically my whole life and decided to up and move to Colorado at the ripe age of 28 (now 30).	Best decision I ever made.	The state is pretty awesome.	13	Indecisiveness	True	False	disagreement	erisk2025
1	z1TPXt_1040_2	Have his issues with his childhood ever been addressed?	Now that I think about it, I had trouble making adult decisions too for a while.	My dad was very domineering so I always felt compelled to have his approval.	13	Indecisiveness	True	False	disagreement	erisk2025
1	z4dg0v_2969_0		My whole life is indecisive lol		13	Indecisiveness	True	False	disagreement	erisk2025
1	zMTvcV_503_10	I think faith and doubt are two sides of the same coin but technically, I can't even be certain my own brain is properly feeding me information.	I can't be certain the choices I make won't fall apart.	I can't be certain a terrorist won't blow up the subway tomorrow.	13	Indecisiveness	True	False	disagreement	erisk2025
1	1mIDAk_319_4	A relocation to Orlando, Paris or a cruise line means that I would miss my sister's pregnancy, and that I would have to abandon my partner.	I've always been terrified of making desicions and the thought of regret just makes me want to melt into the floor.		13	Indecisiveness	True	True	agreement	erisk2025
1	4aGzOv_2067_2	Except that...I didn't make poor decisions.	I made a very good decision.	I am proud of that.	13	Indecisiveness	True	True	agreement	erisk2025
1	6IPRCJ_11_1	I don't think I'm a terrible person... most of the time.	I think I'm a person with good intentions who makes very shitty spur of the moment decisions with somewhat poor judgement.	But does the fact that I don't usually regret these decisions make me a bad person?	13	Indecisiveness	True	True	agreement	erisk2025
1	8C387e_787_0		I get nervous and have trouble deciding.	However, I do learn.	13	Indecisiveness	True	True	agreement	erisk2025
1	9rwsD8_298_1	That's so sad :( thanks for replying.	I don't think I can make any life decisions before I consider every possible outcome.	That also means asking everyone else for advice.	13	Indecisiveness	True	True	agreement	erisk2025
1	9rwsD8_561_23	I'm sure this isn't anywhere close to the situation you're having with your son, but I know for myself I completely resent the fact I wasn't allowed to have any opinions about my present or future.	I have a really hard time trusting that I'm making good decisions because it wasn't until I moved out that I was even allowed to make any.	Edit: for clarity	13	Indecisiveness	True	True	agreement	erisk2025
1	9rwsD8_653_4	I don't know if I'll ever know.	My indecisiveness may end up being the decision.		13	Indecisiveness	True	True	agreement	erisk2025
1	APSX7h_32_36	As a result, I have become visibly less laid-back, and very down-to-earth, no messing around.	I now see things in a much more intellectual way, choosing to analyze each and every situation thoroughly before diving in and possibly making bad decisions.	**tl;dr open the door, get on the floor, everybody walk the dinosaur**	13	Indecisiveness	True	True	agreement	erisk2025
1	AbiwVB_957_0		I have a problem making decisions and the thousands of patterns to choose from are making my eyes hurt.	I've got a ton of yarn and every size needle.	13	Indecisiveness	True	True	agreement	erisk2025
1	BsgN0i_2094_3	I haven't been with anyone since I started medication, so I'm curious how it would affect how I think when things get physical.	My brain has frozen up in the past (unable to make a decision) so I've gone along with things that in retrospect I didn't want to do.		13	Indecisiveness	True	True	agreement	erisk2025
1	D3afya_74_0		I'm usually the decision maker when it comes to this kind of things.	If I ever say thay I don't care it's because I got to choose so many times prior to that point.	13	Indecisiveness	True	True	agreement	erisk2025
1	DTQ5b9_2343_1	I'm still struggling from 5-8pm.	I'm just exhausted and don't make the best choices.	If only I could crawl into bed around 6:30...	13	Indecisiveness	True	True	agreement	erisk2025
1	EGgfEr_769_16	I STILL believe that one day we will get together again.	So, please help, I don't know if I made the right decision.	I know for RIGHT NOW it is.	13	Indecisiveness	True	True	agreement	erisk2025
1	EfkIek_5578_9	I'm fine with just taking day by day but my parents also need me to get work because I'm just a financial burden on them until I can.	I think I'm just very uncertain about a lot of things, obviously it's a lot more than just what I've mentioned that's involved but damn I just have no idea what choices I even have so I can make a decision at all.		13	Indecisiveness	True	True	agreement	erisk2025
1	G5xV2A_680_11	This time, I am queasy sometimes all day, but only getting sick in the very early morning or in the evening.	I am also struggling bad with making food decisions.	I packed a lunch today, all proud of the balanced meal I put together, and thinking about it now is making me feel sick.	13	Indecisiveness	True	True	agreement	erisk2025
1	HgT3cX_113_15	I'm open to other ideas though.	Just looking for some help from the community because I'm having trouble making a good choice myself.		13	Indecisiveness	True	True	agreement	erisk2025
1	JStfCm_152_3	This while mind body struggle thing is something.	I'm normally pretty good at logically making decisions.	Guess I gotta allow myself to be irrational sometimes and ride the waves.	13	Indecisiveness	True	True	agreement	erisk2025
1	K6wYO0_789_8	Which one will be the most/least of a pain in my ass to follow through with?	"I was really bad about making small, generally meaningless decisions like ""Which Pokemon should I start with"" or ""What am I going to eat tonight, sitting at home alone""."	So I took a d6 and colored two sides red, two sides blue, and two sides green.	13	Indecisiveness	True	True	agreement	erisk2025
1	K9Sbrt_90_3	This is an assault that happened to me over 20 yrs ago - 20 yrs of not believing in myself, 20 yrs of doubting my judgement.	I used to be a great leader, but now am constantly indecisive.	I've been told I have low self esteem, and up to a year ago I had no concept of what it means to have a low or high self esteem.	13	Indecisiveness	True	True	agreement	erisk2025
1	KQtOPt_85_36	That's me, a lady with commitment issues and cold feet, hands, and body.	I cant even commit to a doctor's appointment, or a restaurant choice.	The fuck I’d be able to commit to a real person.	13	Indecisiveness	True	True	agreement	erisk2025
1	MkkpBE_5500_0		Decisions make my skin crawl.		13	Indecisiveness	True	True	agreement	erisk2025
1	NKzjr7_1960_0		I don't question the big decisions usually, as they're well researched and discussed, but the day to day stuff i often question my decisions.	I'm struggling with some health issues while pregnant, and trying to parent an almost-3-year-old.	13	Indecisiveness	True	True	agreement	erisk2025
1	Nfj4DT_2530_3	But honestly, I find supermarkets and stores overwhelming.	I can't decide on anything and as a result I buy junk.	I'm also not a great cook, so I look at items and I have no idea how to use it in a meal.	13	Indecisiveness	True	True	agreement	erisk2025
