rank	docno	pre	text	post	source
1	B8PmbX_431_5	When I could be cleaning my room, and I playing games.	I put off things that have tangible deadlines in favor of things that will not likely have a major impact on my life, and have no deadline for me to feel as though I have completed it.		retrieval
2	O0U2vT_91_0		I find myself off task quite often when there are no immediate deadlines looming.	But then again coming from 4+ hours average per day of gaming I think I am still transitioning and I hope to nail down the productivity soon.	retrieval
4	CAhPF3_256_4	Fortunately the error was brought to your attention early in your college life, and you now have the opportunity to start a new healthy habit of studying well in advance.	I've carried the habit off procrastination into my professional life, and it gets me in binds.	Don't make this mistake.	retrieval
5	t5e69h_12_0		I procrastinate sometimes... I only have a high school summer english assignment that I didn't start yet.	School starts in 4 days.	retrieval
7	BfMIME_158_5	I'm finished for the day.	I don't even look at tomorrow's task until I wake up the next morning.	It makes me feel very accomplished, and I don't have to feel guilty about not getting enough done.	retrieval
9	1YbKZb_428_3	I have a different experience.	I have all the intention in the world, but I get hung up on getting the things done, because I can't picture all the steps.	If I'm constantly having to problem solve, I run into a lack of interest value in the thing I doing and switch to one I can.	retrieval
10	NNpWTS_164_2	I'm attending a college with a serious workload and I am a consummate slacker.	I procrastinate.	I blow of my work.	retrieval
11	GxMiSv_515_0		Same, I'll get hyper focused on stuff that I don't need, and neglect tasks that need to get done.	For example I'd sit down to write a 10 page paper, end up 4 hours with an excel spreadsheet workout/muscle growth tracker.	retrieval
12	jC14T5_490_7	* **Problems with procrastination.**	I find that I can only be pressured to start on an assignment when the deadline is very near.	This usually results in a massive amount of stress, missed deadlines, and lost grades.	retrieval
13	mLhqhJ_163_0		"Procrastinate, I always think ""I should probably do my homework, but... I can do in the morning."""	Then I forget to do it in the morning and then I do it before school starts in my first period class.	retrieval
14	DMM2Vl_2_0		"I've been experiencing this more and more often…one thing that truly helps when I need to get ish done but am too clammed up is to listen to a segment from Eckhart Tolle's ""The Power of Now"" on audiobook or a youtube video."	Him explaining how our mind and ego trip us up and ways to become present, is almost an instantaneous boost of clarity.	retrieval
15	t6Cd5S_211_0		I make a list of everything I need to do and when it needs to be done by.	I try to delegate tasks when applicable.	retrieval
16	ltTXdP_430_3	It would be written off, or I'd be abused for finishing anyway.	I often spend more time worrying about/stressing over/not doing the task because I'm afraid of the reaction than I do actually doing the thing.	This is *especially* true for creative projects and my career, in the creative field.	retrieval
17	dG82nV_68_0		I also procrastinate online or on my iPhone to avoid things that I don't want to do.	"I have been on many ""binges"" where I won't even realize that I wasted 2-3 hours (that I definitely DON'T have) mindlessly wandering the internet."	retrieval
18	XgsGVE_430_0		For me sometimes it's like I need to wait till the right time to shower/get dressed - and I plan out what I need to do that day or what I might be able to do that day, like maybe I think I'm too hungry to go shower etc just now and I'll start feeling kinda sick in the shower from the hunger, then I take too long preparing food and think 'oh I need to do item B'.	Sometimes I do manage to kick myself and accept that it's not a catastrophe if I do something in the 'wrong' order but it really varies in severity!	retrieval
19	gMqaCD_142_1	I'm not sure that I do.	I think I've just accepted my inability to get anything done until it's so urgent that I either focus or fail... And even then I don't focus well.		retrieval
21	q8mMuL_1027_0		"Yes, but my *real* bad do-nothing habit is thinking ""I can't start x now because I have to leave for y in an hour."""	Or six hours.	retrieval
22	u2vGrI_12_0		I procrastinate way too much.	Supposed to be studying right now, instead I'm laying on the couch watching Hook... And on Reddit.	retrieval
23	fXwkPM_168_1	Thanks!	I keep reminding myself to take small steps...otherwise I get totally overwhelmed.		retrieval
24	jKxit5_16_1	As someone who takes it regularly with a prescription, YES, and no.	I get work done first then do it for hours.		retrieval
25	NywRGV_76_1	I'm also a night owl but I try to get up relatively early in the morning so I can be out of bed by 8:00 or 9:00 AM.	I have to plan my day to get as much done as possible and then *never stop moving,* or else I run out of steam and get tired.	Basically, once I get going I'm unstoppable.	retrieval
26	0HuQQi_115_3	"or because I'm going out for lunch and the ""correct"" time would be right in the middle of lunch hour (I'd rather avoid that traffic if I can)."	I also delay if I'm in the middle of something.	I really don't think that management cares or keeps track of all this (aside from making sure you take your lunch anyway).	retrieval
27	byczH5_237_3	I plug my laptop into the interface and open a DAW.	Sometimes I end up sitting down and forgetting that I am tired and start working right away.	Sometimes I set it up and go do something else.	retrieval
28	1uBVUn_100_3	I find that when a deadline is imminent or I'm faced with a task that must be accomplished not matter what, I'm often inspired to perform my greatest works.	This also may explain my proclivity for procrastination, as completing things far ahead of time rarely gives me that positive boost and my work is often half assed or sub par to my best.		retrieval
29	UO3lvg_145_2	Nor is inspiration.	Usually I can combat my procrastination to a certain degree because the thing I want to achieve is more important to than my desire to sit on my ass is strong.		retrieval
30	p0clDV_9_0		I tend to work on one thing at a time.	That's not to say that I don't touch other things here and there but in general I have a sort of one-track mind when it comes to work; I'm not great at multitasking.	retrieval
31	LdhfGi_438_5	Work until the alarm goes off then do something else, also with an alarm.	I do housework, so I work until I finish the task.	If I read reddit or anything on my computer, I set a different alarm with a definite limit on the time I spend doing it.	retrieval
32	RiOmw8_212_1	I personally am still a procrastinator but something I do that has been helping me recently is giving myself 55 minutes to so whatever I want and then 5 minutes to do work.	The hardest part for me is to start a task but when I do I usually get in the groove and work on it for a while.	But I give myself 5 minutes so it doesn't sound like I'm going to be stuck working on this boring task for that long so I'll be more inclined to start the task.	retrieval
35	mxeE1J_75_6	But in a job, that might not work.	It's hard to be interrupted, but I find that taking all the time I can/need to think through an idea is not only productive, it's respected by a lot of people.	At least it is in the fields in which I work (I imagine in something like finance, it's a bit different).	retrieval
37	wLNN21_46_16	That's why you take it one day/moment at a time.	"Ex : *wake up* do I want to smoke now *thinks of all pain and tortuous thoughts I'll have if I do* ""not right now"" *do some other activity* rinse repeat."	I knew a buddy who quit around the same time I did, I saw him at a kickback a few weeks later,he was smoking.	retrieval
39	IkpoPk_550_2	I got in this habit early on and it's really hard to break.	I'll usually do it before I realize I've done it.	I much prefer to hang around people of similar intelligence and interests though so I don't have to.	retrieval
40	KiTN0u_39_0		This is totally me, and one of the things that makes me question whether or not I'm an INFJ, just because we're supposed to be people who get things done, I do get things done but most of the time I WANT to get 2384240 things done so it feels like I'm not finishing everything.		retrieval
41	UKyvwf_97_2	I procrastinate school work - I hate school work - but I'm incredibly successful in my field at work.	I don't procrastinate work for some reason.	I just don't find being in school fulfilling, even though I love learning and am constantly auditing classes.	retrieval
45	rf0cWF_844_0		I struggle every day to get shit done.	Honestly, idk if I'll pursue a legal job or J.D. advantage position.	retrieval
46	hIVPwA_376_2	Personally, I end up being more productive when I get the extra hours in the morning as opposed to the extra hours at night.	I'm prone to procrastinating and putting things off, so when the bulk of my free time is at the beginning of my day, I get shit done, and then I have time to really relax after work.	Plus going to the gym first thing is a great way to wake up and get going.	retrieval
47	MrTbtb_573_9	Why am I unable to learn from my mistakes?	It hit me in the middle of a massive berating from my dad that I never seem to fully escape the habit of procrastination.	I always throw out excuses that I am gradually improving, before I would hit a bump in the road, and say it's not worth it to continue.	retrieval
48	7wxzhe_76_1	Get yourself some natural highs.	I find the longer I contemplate... The more likely I am to do it.	Make the decision not to as best as you can and then just go distract yourself for a while!	retrieval
49	BhRGAI_516_7	Convo, and dinner is ready 30 minutes after I step through the front door.	"Once you stop thinking ""OH MY GOD THERES SO MUCH TO DO,"" and actually do it, the process ends up being a lot quicker than you think."	And it gets faster every time until it's an auto pilot thing.	retrieval
50	jP0CQM_169_0		I feel like I do that exactly every day at work... Finally by the end of the day I'll remember that super urgent thing I was working on before it led me on a tangent to something else...		retrieval
40	NqRoXm_433_2	Well done with ketchup.	I can't stand Barack Obama but I bet he knows not to eat a steak well done and then kill it with ketchup.		random
41	ddhxPI_29_0		So, i'm rewatching buffy, and was wondering if anyone knows which episode it is where buffy is running over the rooftops while the buildings are collapsing ?	I think it was a season finale ?	random
42	QZdHvI_304_0		Developer, and usually I play while waiting for things to load/compile because my stuff is slow enough that it takes minutes.	Just enough time to load up some Zelda and explore a little bit.	random
43	weTf2T_207_0		We want to make our lord and savior MaryJ acceptable in the eyes of the masses, but I see this as a tiny step backward,		random
44	20s5O3_436_9	Taking serious inquiries only.	I have a Nin leveled as well with a genji weapon and I will eventually learn the class but am not good enough to call it an alt spec yet.	I am looking for a group that: - has 01-04 on farm - enjoys optimizing and speedrunning competitively - is confident in their ability to tackle super savage in the future - has a good time doing the above	random
